end (Year end),host (Host state ISO3),filed (Year filed),execme_end,execme_filed,v2pariglef_filed,v2pariglef_filed_dummy,v2pariglef_end_dummy,winner,state_lose,settled,v2pariglef_filed_ref,direct,v2pariglef_end,v2pariglef_end_ref1,v2pariglef_end_ref2,caseno (Case no.),parties (Parties to arbitration),direct2,execrlc,execrlc_dummy2,execrlc_dummy,execrlc_count,home (Home state ISO3),partisan,execnat,home2 (Home state2 ISO3),home3 (Home state3 ISO3),home4 (Home state4 ISO3),home5 (Home state5 ISO3),venue (Venue or rules adopted),legal (Legal doc. invoked),invsttype (Text on investment type),sector (Sector 3-letter code),asought_text (Text on award sought),"asought_usm (Award sought in US$m, exchange rate at time of filing, less interest/costs)",concluded (Arbitration concluded),ainvst_text (Text on award to investor),"ainvst_usm (Award to investor in US$m, not including costs/interest)",annul (Annulment filed),annul_filed (Year annulment filed),annul_end (Year annulment ends),annulstatus (Status of annulment)
2001,ARG,1998,ATJE,PJ,3.591,0,NA,unknown,NA,NA,,NA,NA,,coalition: UCR-FREPASO,ARB/98/1,"Houston Industries Energy Inc., et al v. Argentine Republic",NA,2,1,NA,1,USA,,0,n.a.,n.a.,n.a.,n.a.,ICSID,United States-Argentina BIT,Electric power concession,UTL,US$1.1m for tariff compensation and US$1.5m for increased fuel costs,2.6,yes,unknown,unknown,no,n.a.,n.a.,n.a.
2013,CMR,2011,RDPC,RDPC,3.6,0,0,unknown,NA,NA,,0,3.645,,,CONC/11/1,RSM Production Corporation v. Republic of Cameroon,1,0,NA,NA,NA,USA,,0,n.a.,n.a.,n.a.,n.a.,ICSID CR,Contract with host state,Oil and gas,OIL,unknown,unknown,yes,settlement,settlement,n.a.,n.a.,n.a.,n.a.
2014,EGY,2011,FJP,NDP,4.25,0,1,unknown,NA,NA,,NA,1.865,,1.865 (2011),ARB/11/16,"Hussain Sajwani, Damac Park Avenue for Real Estate Development S.A.E., and Damac Gamsha Bay for Development S.A.E. v. Arab Republic of Egypt",NA,0,NA,NA,NA,ARE,,1,n.a.,n.a.,n.a.,n.a.,ICSID,Egypt-United Arab Emirates BIT,Tourism,SER,unknown,unknown,yes,settlement,settlement,n.a.,n.a.,n.a.,n.a.
2010,MEX,2002,PAN,PAN,4.727,0,0,unknown,NA,NA,,NA,4.534,,4.523 (2009),n.a.,Calmark Commercial Development Inc. v. the United Mexican States,NA,1,0,0,0,USA,,0,n.a.,n.a.,n.a.,n.a.,UNCITRAL,NAFTA,Real estate,RE,US$400000 plus interest,0.4,yes,settlement,settlement,n.a.,n.a.,n.a.,n.a.
unknown,CZE,2006,NA,CSSD,1.571,1,NA,unknown,NA,NA,,NA,NA,,,n.a.,Czechoslonor v. Czech Republic,NA,n.a.,NA,NA,NA,NOR,n.a.,NA,n.a.,n.a.,n.a.,n.a.,UNCITRAL,Czech Republic-Norway BIT,Agricultural enterprise (fishing),AGR,CZK240m / ?_8.5m,10.3,unknown,n.a.,n.a.,n.a.,n.a.,n.a.,n.a.
unknown,ETH,1999,NA,TPLF,2.5,1,NA,unknown,NA,NA,2.5 (2000),NA,NA,,,10623/AER/ACS,"Salini Costruttori SPA v. Federal Democratic Republic of Ethiopia, Addis Ababa Water and Sewerage Authority",NA,n.a.,NA,NA,NA,ITA,,NA,n.a.,n.a.,n.a.,n.a.,ICC,Contract with host state,Construction (dam and transmission lines),UTL,"US$26700000, plus interest and costs",26.7,yes,unknown,unknown,n.a.,n.a.,n.a.,n.a.
unknown,POL,1998,NA,SRP,1.714,1,NA,unknown,NA,NA,1.714 (1996),NA,NA,,,n.a.,Lutz Ingo Schaper v. Poland,NA,n.a.,NA,NA,NA,DEU,,NA,n.a.,n.a.,n.a.,n.a.,UNCITRAL,Germany-Poland BIT,Waste paper enterprise,MFG,DM5m,3,yes,unknown,unknown,n.a.,n.a.,n.a.,n.a.
unknown,PRT,2002,NA,PS,2.2,1,NA,unknown,NA,NA,,NA,NA,,,n.a.,German investor v. Portugal,NA,n.a.,NA,NA,NA,DEU,,NA,n.a.,n.a.,n.a.,n.a.,UNCITRAL,Germany-Portugal BIT,unknown,unknown,unknown,unknown,yes,settlement,settlement,n.a.,n.a.,n.a.,n.a.
2012,ZAR,2010,independent,independent,NA,NA,NA,unknown,NA,NA,,NA,NA,,,ARB/10/21,"International Quantum Resources Limited, Frontier SPRL and Compagnie Mini??re de Sakania SPRL v. Democratic Republic of the Congo",NA,0,NA,NA,NA,VGB,,0,n.a.,n.a.,n.a.,n.a.,ICSID,Congo (Democratic Republic of) Domestic Investment Law,Mining,MIN,unknown,unknown,yes,settlement,settlement,n.a.,n.a.,n.a.,n.a.
2004,ARG,2004,PJ,PJ,2.545,1,1,unclear,NA,NA,,NA,2.582,,,n.a.,United Utilities International Limited (UUIL) v Argentine Republic,NA,3,1,1,2,GBR,,1,n.a.,n.a.,n.a.,n.a.,UNCITRAL,Argentina-United Kingdom BIT,Electric power concession,UTL,US$100m,100,yes,settlement,settlement,n.a.,n.a.,n.a.,n.a.
1999,ALB,1994,PSS,PDS,4.04,0,1,state,0,0,,0,1.806,,,ARB/94/2,Tradex Hellas SA v. Republic of Albania,1,3,1,1,2,GRC,,0,n.a.,n.a.,n.a.,n.a.,ICSID,"Albania-Greece BIT, Albania Investment Law (1993)",Agricultural enterprise,AGR,US$3107074 plus interest and costs,3.1,yes,0,0,no,n.a.,n.a.,n.a.
2015,ALB,2011,PSS,PDS,4.04,0,1,state,0,0,,0,2.439,,,ARB/11/24,Mamidoil Jetoil Greek Petroleum Products Societe Anonyme S.A. v. Republic of Albania,1,3,1,1,2,GRC,,0,n.a.,n.a.,n.a.,n.a.,ICSID,Greece-Albania BIT,Oil and gas,OIL,US$23m,23,yes,0,0,yes,2015,pending,pending
2007,ALB,2007,PDS,PDS,4.04,0,0,state,0,0,,0,4.04,,,ARB/07/21,Pantechniki SA Contractors & Engineers v. Republic of Albania,1,1,0,0,0,GRC,,0,n.a.,n.a.,n.a.,n.a.,ICSID,"Albania-Greece BIT, Albania Investment Law (1993)",Highway and bridge construction project,UTL,At least US$1.8m,1.8,yes,0,0,no,n.a.,n.a.,n.a.
2013,ALB,2011,PDS,PDS,4.04,0,0,state,0,0,,0,4.04,,,ARB/11/18,Burimi SRL and Eagle Games SH.A v. Republic of Albania,1,1,0,0,0,ITA,,0,n.a.,n.a.,n.a.,n.a.,ICSID,"Albania-Italy BIT, Albania Investment Law (1993)",Gaming,SER,"Albanian Lek 1,034,794,456 plus interest",10.2,yes,0,0,no,n.a.,n.a.,n.a.
2013,ALB,2011,PDS,PDS,4.04,0,0,state,0,0,,NA,4.04,,,n.a.,"Sky Petroleum, Inc. v. Ministry of Economy, Trade, and Energy of Albania et al",NA,1,0,0,0,USA,,0,n.a.,n.a.,n.a.,n.a.,UNCITRAL,Albania-US BIT,Oil and gas,OIL,Approximately US$1b,1000,yes,0,0,n.a.,n.a.,n.a.,n.a.
2009,AZE,2006,YAP,YAP,3.7,0,0,state,0,0,,0,3.616,3.63,,ARB/06/15,"Azpetrol International Holdings BV, Azpetrol Group BV & Azpetrol Oil Services Group BV v. Republic of Azerbaijan",1,0,NA,NA,NA,NLD,,0,n.a.,n.a.,n.a.,n.a.,ICSID,Energy Charter Treaty,Oil and gas,OIL,unknown,unknown,yes,0,0,no,n.a.,n.a.,n.a.
2010,BGD,2006,AL,BNP,4.286,0,1,state,0,0,,0,2.964,,,ARB/06/10,"Chevron Block Twelve, Chevron Blocks Thirteen & Fourteen v. People??s Republic of Bangladesh",1,0,NA,NA,NA,USA,,0,n.a.,n.a.,n.a.,n.a.,ICSID,Contract with host state,Oil and gas,OIL,Approximately US$240m,240,yes,0,0,no,n.a.,n.a.,n.a.
1994,BGD,1992,BNP,BNP,4.5,0,0,state,0,0,,NA,4.247,,,ARB/92/2,"Scimitar Exploration Limited v. Bangladesh and Bangladesh Oil, Gas and Mineral Corporation",NA,0,NA,NA,NA,GBR,,1,n.a.,n.a.,n.a.,n.a.,ICSID,UK-Bangladesh BIT,Oil and gas (exploration),OIL,US$25000000,25,yes,0,0,no,n.a.,n.a.,n.a.
2008,BGR,2003,BSP,NMSII,3.25,0,NA,state,0,0,NDSV,0,NA,,NA,ARB/03/24,Plama Consortium Limited v. Republic of Bulgaria,1,0,NA,NA,NA,CYP,,0,FIN,n.a.,n.a.,n.a.,ICSID,"Bulgaria-Cyprus BIT, Bulgaria-Finland BIT, Energy Charter Treaty",Oil and gas,OIL,US$300m,300,yes,0,0,no,n.a.,n.a.,n.a.
2007,CAN,2000,CPC,LPC,3.333,0,0,state,0,0,,0,4.181,,,n.a.,United Parcel Service of America Inc. v. Canada,1,1,0,0,0,USA,,0,n.a.,n.a.,n.a.,n.a.,UNCITRAL,NAFTA,Postal services,SER,Not less than US$160m,160,yes,0,0,n.a.,n.a.,n.a.,n.a.
2010,CAN,2009,CPC,CPC,4.667,0,0,state,0,0,,0,4.181,,,(PCA Case No. 2009-21),Centurion Health Corporation et al v. Canada,1,1,0,0,0,USA,,0,n.a.,n.a.,n.a.,n.a.,PCA,NAFTA,Health (operating medical center),SER,US$160m,160,yes,0,0,n.a.,n.a.,n.a.,n.a.
2011,CAN,2007,CPC,CPC,4.667,0,0,state,0,0,,0,4.181,,,55798,Vito G. Gallo v. Canada,1,1,0,0,0,USA,,0,n.a.,n.a.,n.a.,n.a.,PCA,NAFTA,Waste management,SER,US$355100000 plus costs,355.1,yes,0,0,n.a.,n.a.,n.a.,n.a.
2015,CAN,2011,CPC,CPC,4.667,0,0,state,0,0,,0,4.181,,,2012-25,Detroit International Bridge Company v. Canada,1,1,0,0,0,USA,,0,n.a.,n.a.,n.a.,n.a.,PCA,NAFTA,"Bridge (build, operate, maintain, collect tolls)",UTL,US$3.5b,3500,yes,0,0,no,n.a.,n.a.,n.a.
2010,CRI,2007,PLN,PLN,4.083,0,0,state,0,0,,0,3.232,,,ARB(AF)/07/3,Alasdair Ross Anderson and others v. Republic of Costa Rica,1,3,1,1,2,CAN,,0,n.a.,n.a.,n.a.,n.a.,ICSID AF,Canada-Costa Rica BIT,Finance (private equity),FIN,unknown,unknown,yes,0,0,no,n.a.,n.a.,n.a.
2013,CZE,2009,ODS,ODS,4.606,0,0,state,0,0,,0,4.229,,,5/1/2010,ECE Projektmanagement v. The Czech Republic,1,0,NA,NA,NA,DEU,,0,n.a.,n.a.,n.a.,n.a.,PCA,Czech Republic-Germany BIT,Real estate (commercial),RE,?_70289m,80.8,yes,0,0,n.a.,n.a.,n.a.,n.a.
2011,CZE,2009,independent,ODS,4.606,0,NA,state,0,0,,0,NA,,,n.a.,Peter Franz Vocklinghaus v. Czech Republic,1,0,NA,NA,NA,DEU,,0,n.a.,n.a.,n.a.,n.a.,UNCITRAL,Germany-Czech Republic BIT,Tourism (golf course and resort),SER,CZK1b,52,yes,0,0,n.a.,n.a.,n.a.,n.a.
2010,CZE,2009,independent,ODS,4.606,0,NA,state,0,0,,NA,NA,,,n.a.,Georg Nepolsky v. Czech Republic,NA,0,NA,NA,NA,DEU,,0,n.a.,n.a.,n.a.,n.a.,UNCITRAL,Czech Republic-Germany BIT,Water services concession,UTL,Czech Koruna 1.24b,64.3,yes,0,0,n.a.,n.a.,n.a.,n.a.
2012,CZE,2008,independent,ODS,4.642,0,NA,state,0,0,,0,NA,,,n.a.,InterTrade v Czech Republic,1,0,NA,NA,NA,DEU,,0,n.a.,n.a.,n.a.,n.a.,UNCITRAL,Czech Republic-Germany BIT,Agricultural enterprise (forestry),AGR,Approximately ?_150m,210.9,yes,0,0,n.a.,n.a.,n.a.,n.a.
2012,CZE,2008,independent,ODS,4.642,0,NA,state,0,0,,NA,NA,,,NN 452/FM,Konsortium Oeconomismus v. Czech Republic,NA,0,NA,NA,NA,CHE,,0,n.a.,n.a.,n.a.,n.a.,ICC,Czech Republic-Switzerland BIT,Waste management,SER,CZK8024742.85,0.4,yes,0,0,no,n.a.,n.a.,n.a.
2010,CZE,2007,independent,ODS,4.678,0,NA,state,0,0,,0,NA,,,n.a.,Frontier Petroleum Services (FPS) v Czech Republic,1,0,NA,NA,NA,CAN,,0,n.a.,n.a.,n.a.,n.a.,UNCITRAL,Canada-Czech Republic BIT,Manufacturing (aviation),MFG,US$20m,20,yes,0,0,n.a.,n.a.,n.a.,n.a.
2009,CZE,2007,ODS,ODS,4.678,0,0,state,0,0,,1,4.263,4.229,,n.a.,Invesmart v. Czech Republic,0,0,NA,NA,NA,NLD,,0,n.a.,n.a.,n.a.,n.a.,UNCITRAL,Czech Republic-Netherlands BIT,Banking,FIN,unknown,unknown,yes,0,0,n.a.,n.a.,n.a.,n.a.
2012,EGY,2009,FJP,NDP,4.25,0,1,state,0,0,,0,1.865,,1.865 (2011),ARB/09/15,"H&H Enterprises Investments, Inc. v. Arab Republic of Egypt",1,0,NA,NA,NA,USA,,1,n.a.,n.a.,n.a.,n.a.,ICSID,United States-Egypt BIT,Tourism (resort),SER,unknown,unknown,yes,0,0,yes,2014,pending,pending
2014,EGY,2011,FJP,NDP,4.25,0,1,state,0,0,,0,1.865,,1.865 (2011),ARB/11/7,National Gas S.A.E. v. Arab Republic of Egypt,1,0,NA,NA,NA,EGY,,1,n.a.,n.a.,n.a.,n.a.,ICSID,Egypt-United Arab Emirates BIT,Oil and gas (distribution),OIL,unknown,unknown,yes,0,0,no,n.a.,n.a.,n.a.
2004,EGY,2003,NDP,NDP,4.25,0,0,state,0,0,,0,4.19,,,ARB/03/11,Joy Mining Machinery Limited v. Arab Republic of Egypt,1,0,NA,NA,NA,GBR,,0,n.a.,n.a.,n.a.,n.a.,ICSID,Egypt-United Kingdom BIT,Mining (phosphate),MIN,"UK??2.5m, plus interest and the full value of the bank guarantees if not released",4.5,yes,0,0,yes,2005,2005,discontinued
2006,EGY,2002,NDP,NDP,4.25,0,0,state,0,0,,0,4.19,,,ARB/02/9,"Champion Trading Company and Ameritrade International, Inc. v. Arab Republic of Egypt",1,0,NA,NA,NA,USA,,0,n.a.,n.a.,n.a.,n.a.,ICSID,US-Egypt BIT,Agricultural enterprise (cotton),AGR,US$365m plus interest and costs,365,yes,0,0,no,n.a.,n.a.,n.a.
2008,EGY,2004,NDP,NDP,4.25,0,0,state,0,0,,0,4.19,,,ARB/04/13,Jan de Nul NV & Dredging International NV v. Arab Republic of Egypt,1,0,NA,NA,NA,BELLUX,,0,n.a.,n.a.,n.a.,n.a.,ICSID,Belgium & Luxembourg-Egypt BIT,Dredging operations,SER,Approximately US$70m,70,yes,0,0,no,n.a.,n.a.,n.a.
2008,EGY,2005,NDP,NDP,4.25,0,0,state,0,0,,0,4.19,,,ARB/05/19,Helnan International Hotels A/S v. Arab Republic of Egypt,1,0,NA,NA,NA,DNK,,0,n.a.,n.a.,n.a.,n.a.,ICSID,Denmark-Egypt BIT,Tourism (hotel),SER,Up to ?_42m,50,yes,0,0,yes,2008,2010,partially overturned
2011,EGY,2008,NDP,NDP,4.25,0,0,state,0,0,,0,4.19,,,ARB/08/18,Malicorp Limited v. Egypt,1,0,NA,NA,NA,GBR,,0,n.a.,n.a.,n.a.,n.a.,ICSID,Egypt-United Kingdom BIT,Airport,SER,unknown,unknown,yes,0,0,yes,2011,2013,upheld
2015,ESP,2012,PP,PP,4.6,0,0,state,0,0,AP / PP,0,4.395,,,ARB/12/17,"Inversion y Gestion de Bienes, IGB, S.L. and IGB18 Las Rozas, S.L. v. Kingdom of Spain",1,1,0,0,0,VEN,,0,n.a.,n.a.,n.a.,n.a.,ICSID,Spain-Venezuela BIT,Real estate,RE,EUR25m,31,yes,0,0,no,n.a.,n.a.,n.a.
2016,ESP,2012,PP,PP,4.6,0,0,state,0,0,,0,4.395,,,(SCC Case No. 062/2012),Charanne B.V. and Construction Investments S.a.r.l. v. Spain,1,1,0,0,0,NLD,,0,LUX,n.a.,n.a.,n.a.,SCC,Energy Charter Treaty,Electric power concession (solar),UTL,EUR17m,22,no,n.a.,n.a.,n.a.,n.a.,n.a.,n.a.
2016,ESP,2013,PP,PP,4.6,0,0,state,0,0,,0,4.395,,,(SCC Case No. 2013/153),Isolux Infrastructure Netherlands B.V. v. Spain,1,1,0,0,0,NLD,,0,n.a.,n.a.,n.a.,n.a.,SCC,Energy Charter Treaty,Electric power concession (solar),UTL,unknown,unknown,no,n.a.,n.a.,n.a.,n.a.,n.a.,n.a.
2001,EST,1999,IL,IL,4.8,0,0,state,0,0,I (Pro Patria Union),0,4.6205,,,ARB/99/2,"Alex Genin, Eastern Credit Limited Inc v. Republic of Estonia",1,1,0,0,0,USA,,0,n.a.,n.a.,n.a.,n.a.,ICSID,US-Estonia BIT,Banking,FIN,"Enumerated two claims: US$1639344, and between US$50m and US$70m for damages",51.6,yes,0,0,no,n.a.,n.a.,n.a.
2010,GHA,2007,NDC,NPP,3.75,0,1,state,0,0,,0,2.049,,,ARB/07/24,Gustav F W Hamester GmbH & Co KG v. Republic of Ghana,1,3,1,1,2,DEU,,0,n.a.,n.a.,n.a.,n.a.,ICSID,Germany-Ghana BIT,Agricultural enterprise (cocoa),AGR,Over ?_100m,144,yes,0,0,no,n.a.,n.a.,n.a.
2014,GIN,2012,RPG,RPG,5,0,0,state,0,0,5 (2013),1,4.516,,4.516 (2013),ARB/12/8,Societe Industrielle des Boissons de Guinee v. Republic of Guinea,0,0,NA,NA,NA,FRA,,0,n.a.,n.a.,n.a.,n.a.,ICSID,"Guinean Investment Law (1987), Contract",Beverage production enterprise,MFG,unknown,unknown,yes,0,0,no,n.a.,n.a.,n.a.
2015,GNQ,2012,PDGE,PDGE,5.333,0,0,state,0,0,,0,4.814,,,ARB(AF)/12/2,Grupo Francisco Hernando Contreras v. Republic of Equatorial Guinea,1,0,NA,NA,NA,ESP,,0,n.a.,n.a.,n.a.,n.a.,ICSID AF,Equatorial Guinea-Spain BIT,Real estate (residential and commercial),RE,EUR450m,600,yes,n.a.,n.a.,n.a.,n.a.,n.a.,n.a.
2010,HRV,2007,HDZ,HDZ,4,0,0,state,0,0,,0,3.797,,,n.a.,Adria Beteiligungs GmbH v. The Republic of Croatia,1,1,0,0,0,AUT,,1,n.a.,n.a.,n.a.,n.a.,UNCITRAL,Austria-Croatia BIT,Gaming,SER,Approximately US$64m,64,yes,0,0,n.a.,n.a.,n.a.,n.a.
2008,HRV,2004,HDZ,HDZ,4,0,0,state,0,0,,1,3.797,,,n.a.,Ulemek (Select Office Equipment) v. Croatia,0,1,0,0,0,CAN,,1,n.a.,n.a.,n.a.,n.a.,UNCITRAL,Canada-Croatia BIT,Manufacturing (office equipment),MFG,CAD2.6m,3,yes,0,0,n.a.,n.a.,n.a.,n.a.
2014,HUN,2011,FiDeSz-MPSz,FiDeSz-MPSz,3.607,0,0,state,0,0,,0,4.097,,,ARB/11/22,Vigotop Limited v. Hungary,1,1,0,0,0,CYP,,0,n.a.,n.a.,n.a.,n.a.,ICSID,Cyprus-Hungary BIT,Tourism (resort),SER,Range: Between ?_278.3m and ?_312.6m,382.5,yes,0,0,no,n.a.,n.a.,n.a.
2015,HUN,2012,FiDeSz-MPSz,FiDeSz-MPSz,3.6425,0,0,state,0,0,,0,3.547,,4.097 (2014),ARB/12/3,Accession Mezzanine Capital L.P. and DanubiusKereskedohaz Vagyonkezelo Zrt. v. Hungary,1,n.a.,NA,NA,NA,GBR,,0,BMU,n.a.,n.a.,n.a.,ICSID,Hungary-UK BIT,Broadcasting enterprise (radio),TEL,unknown,unknown,no,0,0,no,n.a.,n.a.,n.a.
2014,HUN,2012,FiDeSz-MPSz,FiDeSz-MPSz,3.6425,0,0,state,0,0,,0,4.097,,,ARB/12/2,"Emmis International Holding B.V., Emmis Radio Operating B.V., MEM Magyar Electronic Media Kereskedelmi Szolgaltat?? Kft. v. Hungary",1,1,0,0,0,NLD,,0,CHE,n.a.,n.a.,n.a.,ICSID,"Hungary-Netherlands BIT, Hungary-Switzerland BIT",Broadcasting enterprise (radio),TEL,unknown,unknown,yes,0,0,no,n.a.,n.a.,n.a.
2014,IDN,2011,PD,PD,3.167,0,0,state,0,0,,0,3.137,,,ARB/11/13,Rafat Ali Rizvi v. Republic of Indonesia,1,0,NA,NA,NA,GBR,,0,n.a.,n.a.,n.a.,n.a.,ICSID,Indonesia-United Kingdom BIT,Banking,FIN,unknown,unknown,yes,0,0,yes,2013,pending,pending
2014,IDN,2011,PD,PD,3.167,0,0,state,0,0,,0,3.137,,,n.a.,Hesham T. M. Al Warraq v. Republic of Indonesia,1,n.a.,NA,NA,NA,SAU,,0,n.a.,n.a.,n.a.,n.a.,UNCITRAL,"Agreement on Promotion, Protection and Guarantee of Investments among Member States of the Organisation of the Islamic Conference",Banking,FIN,US$9671060,9.7,yes,0,0,n.a.,n.a.,n.a.,n.a.
2006,KEN,2000,NARC,Kanu,4.25,0,NA,state,0,0,,0,NA,,NA,ARB/00/7,World Duty Free Company Limited v. Republic of Kenya,1,0,NA,NA,NA,GBR,,0,n.a.,n.a.,n.a.,n.a.,ICSID,Contract with host state,Duty free concession,SER,Approximately US$500m,500,yes,0,0,no,n.a.,n.a.,n.a.
2013,KHM,2009,CPP,CPP,3.8,0,0,state,0,0,KPK,0,3.663,,,ARB/09/18,Cambodia Power Company v. Kingdom of Cambodia,1,3,1,1,2,USA,,0,n.a.,n.a.,n.a.,n.a.,ICSID,Contract with host state,Electric power concession,UTL,US$65m,65,yes,0,0,no,n.a.,n.a.,n.a.
2013,MDA,2012,independent,PDM,3.166,0,NA,state,0,0,,0,NA,,,V091/2012,Grand Torg SRL v. Moldova (also known as Yuri Bogdanov and Yulia Bodganova v. Republic of Moldova),1,-999,NA,NA,NA,RUS,,NA,n.a.,n.a.,n.a.,n.a.,SCC,Moldova-Russian Federation BIT,Manufacturing (chemical products),MFG,US$150000,0.2,yes,0,0,n.a.,n.a.,n.a.,n.a.
2013,MDA,2012,independent,PDM,3.166,0,NA,state,0,0,,0,NA,,,V091/2012,Yuri Bogdanov and Yulia Bogdanova v. Republic of Moldova (IV),1,-999,NA,NA,NA,RUS,,NA,n.a.,n.a.,n.a.,n.a.,SCC,Moldova-Russia BIT,Manufacturing (paint),MFG,MDL1.5m,0.12,yes,0,0,no,n.a.,n.a.,n.a.
2004,MEX,2000,PAN,PRI,3.727,0,0,state,0,0,,0,4.718,,4.767 (2003),ARB(AF)/00/3,Waste Management v. United Mexican States (2nd case),1,1,0,0,0,USA,,0,n.a.,n.a.,n.a.,n.a.,ICSID AF,NAFTA,Waste management,SER,"Not less than US$36m, plus costs",36,yes,0,0,no,n.a.,n.a.,n.a.
2000,MEX,1998,PRI,PRI,3.788,0,0,state,0,0,,0,3.629,,,ARB(AF)/98/2,Waste Management v. United Mexican States (1st case),1,2,1,NA,1,USA,,0,n.a.,n.a.,n.a.,n.a.,ICSID AF,NAFTA,Waste management,SER,"Not less than US$36m, plus costs",36,yes,0,0,no,n.a.,n.a.,n.a.
1999,MEX,1997,PRI,PRI,3.818,0,0,state,0,0,,0,3.604,,3.629 (2000),ARB(AF)/97/2,"Robert Azinian, et al v. United Mexican States",1,2,1,NA,1,USA,,0,n.a.,n.a.,n.a.,n.a.,ICSID AF,"NAFTA, Contract",Waste management,SER,Up to US$19.2m,19.2,yes,0,0,no,n.a.,n.a.,n.a.
2007,MEX,2005,PAN,PAN,4.666,0,0,state,0,0,,0,4.588,,4.621 (2006),ARB(AF)/05/1,"Bayview Irrigation District, et al v. United Mexican States",1,1,0,0,0,CAN,,0,n.a.,n.a.,n.a.,n.a.,ICSID AF,NAFTA,Agricultural enterprise,AGR,Up to US$667687930,667.7,yes,0,0,no,n.a.,n.a.,n.a.
2006,MEX,2002,PAN,PAN,4.727,0,0,state,0,0,,0,4.621,,,n.a.,International Thunderbird Gaming Corporation v. United Mexican States,1,1,0,0,0,CAN,,0,n.a.,n.a.,n.a.,n.a.,UNCITRAL,NAFTA,Gaming,SER,Not less than US$100m,100,yes,0,0,n.a.,n.a.,n.a.,n.a.
2006,MEX,2002,PAN,PAN,4.727,0,0,state,0,0,,0,4.621,,,ARB(AF)/02/1,Fireman's Fund Insurance Company v. United Mexican States,1,1,0,0,0,USA,,0,n.a.,n.a.,n.a.,n.a.,ICSID AF,NAFTA,Finance (debt instruments),FIN,US$50m,50,yes,0,0,no,n.a.,n.a.,n.a.
2004,MEX,2002,PAN,PAN,4.727,0,0,state,0,0,,0,4.718,,4.767 (2003),n.a.,GAMI Investments v. United Mexican States,1,1,0,0,0,USA,,0,n.a.,n.a.,n.a.,n.a.,UNCITRAL,NAFTA,Agricultural enterprise (sugar),AGR,US$27.8m,27.8,yes,0,0,n.a.,n.a.,n.a.,n.a.
2015,MKD,2012,VMRO-DPMNE,VMRO-DPMNE,4.417,0,0,state,0,0,,0,4.366,,,ARB/12/31,"Guardian Fiduciary Trust, Ltd, f/k/a Capital Conservator Savings & Loan, Ltd v. Macedonia, former Yugoslav Republic of",1,0,NA,NA,NA,NLD,,1,n.a.,n.a.,n.a.,n.a.,ICSID,Netherlands-Macedonia BIT,Banking,FIN,US$20m,20,yes,0,0,no,n.a.,n.a.,n.a.
2008,PER,2006,PAP,PP,4.167,0,0,state,0,0,,0,4.489,,4.489 (2006),ARB/06/13,Aguaytia Energy LLC v. Republic of Peru,1,3,1,1,2,USA,,0,n.a.,n.a.,n.a.,n.a.,ICSID,"Contract with host state (""Legal stability"" clause)",Electric power concession,UTL,US$91.1m,91.1,yes,0,0,no,n.a.,n.a.,n.a.
2013,PER,2010,Gana Peru,PAP,4.667,0,NA,state,0,0,,0,NA,,coalition (GANA PERU),ARB/10/2,Convial Callao SA and CCI - Compania de Concesiones de Infraestructura SA v. Republic of Peru,1,3,1,1,2,ARG,,1,n.a.,n.a.,n.a.,n.a.,ICSID,Argentina-Peru BIT,Highway construction project,UTL,At least US$114.5m,114.5,yes,0,0,no,n.a.,n.a.,n.a.
2014,PER,2010,Gana Peru,PAP,4.667,0,NA,state,0,0,,0,NA,,coalition (GANA PERU),ARB/10/17,Renee Rose Levy de Levi v. Republic of Peru,1,3,1,1,2,FRA,,1,n.a.,n.a.,n.a.,n.a.,ICSID,France-Peru BIT,Banking,FIN,US$4.036m (plus interest at 11.11%) for material damages and $2.953m for moral damages,7,yes,0,0,yes,2014,2014,discontinued
2015,PER,2011,Gana Peru,PAP,4.667,0,NA,state,0,0,,0,NA,,coalition (GANA PERU),ARB/11/17,Renee Rose Levy and Gremcitel S.A. v. Republic of Peru,1,n.a.,NA,NA,NA,FRA,,1,n.a.,n.a.,n.a.,n.a.,ICSID,France-Peru BIT,Real estate,RE,US$41000m,41000,no,0,0,no,n.a.,n.a.,n.a.
2005,PER,2003,PP,PP,4.667,0,0,state,0,0,4.667 (2006),1,3.978,,3.978 (2001),ARB/03/4,Lucchetti SA & Lucchetti Peru SA v. Republic of Peru,0,2,1,NA,1,CHL,,0,n.a.,n.a.,n.a.,n.a.,ICSID,Chile-Peru BIT,Manufacturing (pasta),MFG,unknown,unknown,yes,0,0,yes,2005,2007,upheld
2013,PER,2011,Gana Peru,PAP,4.667,0,NA,state,0,0,,NA,NA,,coalition (GANA PERU),ARB/11/9,Caraveli Cotaruse Transmisora de Energia S.A.C. v. Republic of Peru,NA,3,1,1,2,ESP,,1,n.a.,n.a.,n.a.,n.a.,ICSID,Contract with host state,Electric power concession,UTL,US$100m,100,yes,0,0,no,n.a.,n.a.,n.a.
2014,PHL,2011,LP,LP,4,0,0,state,0,0,,0,3.836,,,ARB/11/12,Fraport AG Frankfurt Airport Services Worldwide v. Republic of the Philippines,1,2,1,NA,1,DEU,,0,n.a.,n.a.,n.a.,n.a.,ICSID,Germany-Philippines BIT,Airport,SER,unknown,unknown,yes,0,0,no,n.a.,n.a.,n.a.
2007,PHL,2003,Lakas-CMD,Lakas-CMD,4.5,0,0,state,0,0,,0,4.381,,,ARB/03/25,Fraport AG Frankfurt Airport Services Worldwide v. Republic of the Philippines,1,2,1,NA,1,DEU,,0,n.a.,n.a.,n.a.,n.a.,ICSID,Germany-Philippines BIT,Airport,SER,Approximately US$450m,450,yes,0,0,yes,2008,2010,overturned
2011,POL,2009,PO,PiS,3.142,0,0,state,0,0,,NA,3.451,,,16509/JHN,East Cement for Investment Company v. Poland,NA,2,1,NA,1,JOR,,0,n.a.,n.a.,n.a.,n.a.,ICC,Poland-Jordan BIT,Manufacturing (cement),MFG,US$280000,0.3,yes,0,0,no,n.a.,n.a.,n.a.
2011,POL,2008,PO,PiS,3.357,0,0,state,0,0,,0,3.451,,,n.a.,Mercuria Energy Group Limited (Mercuria) v. Poland,1,2,1,NA,1,CYP,,0,n.a.,n.a.,n.a.,n.a.,SCC,Energy Charter Treaty,Oil and gas,OIL,US$700m,700,yes,0,0,n.a.,n.a.,n.a.,n.a.
2012,POL,2008,PO,PiS,3.357,0,0,state,0,0,,1,3.431,,3.451 (2011),n.a.,TRACO Deutsche Travertinwerke GmbH v. The Republic of Poland,0,2,1,NA,1,DEU,,0,n.a.,n.a.,n.a.,n.a.,UNCITRAL,Germany-Poland BIT,Mining (quarrying),MIN,?_8.2m,10.6,yes,0,0,n.a.,n.a.,n.a.,n.a.
2009,POL,2006,PiS,PiS,3.428,0,1,state,0,0,,0,2.896,,,n.a.,Nordzucker v Poland,1,1,0,0,0,DEU,,0,n.a.,n.a.,n.a.,n.a.,UNCITRAL,Germany-Poland BIT,Agricultural enterprise (sugar),AGR,?_153.7 m,165,yes,0,0,n.a.,n.a.,n.a.,n.a.
2014,POL,2012,PO,PO,3.535,0,0,state,0,0,,0,3.392,,3.372 (2015),1/1/2013,Enkev Beheer B.V. v. The Republic of Poland,1,2,1,NA,1,NLD,,0,n.a.,n.a.,n.a.,n.a.,PCA,Netherlands-Poland BIT,Manufacturing,MFG,unknown,unknown,yes,0,0,no,n.a.,n.a.,n.a.
2015,POL,2011,PO,PO,3.571,0,0,state,0,0,,0,3.372,,,ARB(AF)/11/3,"Vincent J. Ryan, Schooner Capital LLC, and Atlantic Investment Partners LLC v. Republic of Poland",1,2,1,NA,1,USA,,0,n.a.,n.a.,n.a.,n.a.,ISCID AF,Poland-United States BIT,Manufacturing (vegetable oil),MFG,PLN500m,146.2m,yes,0,0,no,n.a.,n.a.,n.a.
2001,PRY,1998,Colorado,Colorado,4.667,0,0,state,0,0,,0,3.823,,3.447 (2003),ARB/98/5,Eudoro Armando Olguin v. Republic of Paraguay,1,1,0,0,0,PER,,0,n.a.,n.a.,n.a.,n.a.,ICSID,Paraguay-Peru BIT,Manufacturing (foodstuffs),MFG,"Paraguayan Guarani 2407057500, plus interest",1.3,yes,0,0,no,n.a.,n.a.,n.a.
2020,RUS,2015,United Russia,United Russia,3.033,0,1,state,0,0,,0,2.989,,2.989 (2016),unknown,Sergei Viktorovich Pugachev v. The Russian Federation,1,2,1,NA,1,FRA,,0,n.a.,n.a.,n.a.,n.a.,UNCITRAL,Russian-France BIT,,,US$12000m,12000,no,n.a.,n.a.,n.a.,n.a.,n.a.,n.a.
2011,RUS,2009,United Russia,United Russia,3.167,0,0,state,0,0,,NA,3.151,,,n.a.,Cesare Galdabini SpA v. Russian Federation,NA,2,1,NA,1,ITA,,0,n.a.,n.a.,n.a.,n.a.,UNCITRAL,Italy-Russia BIT,Finance (debt instruments),FIN,unknown,unknown,yes,0,0,n.a.,n.a.,n.a.,n.a.
2011,SLV,2009,FMLN,ARENA,5,0,1,state,0,0,,0,1.676,,1.824 (2012),ARB/09/17,"Commerce Group Corp. and San Sebastian Gold Mines, Inc. v. Republic of El Salvador",1,3,1,1,2,USA,,0,n.a.,n.a.,n.a.,n.a.,ICSID,"CAFTA-DR, El Salvador Investment Law (1999)",Mining,MIN,US$100m,100,yes,0,0,yes,2011,2013,discontinued
2006,SLV,2003,ARENA,ARENA,5,0,0,state,0,0,,0,4.574,,,ARB/03/26,Inceysa Vallisoletana S.L. v. Republic of El Salvador,1,1,0,0,0,ESP,,0,n.a.,n.a.,n.a.,n.a.,ICSID,El Salvador-Spain BIT,Vehicle inspection facilities,SER,Not less than US$120m,120,yes,0,0,no,n.a.,n.a.,n.a.
2012,SVK,2006,SDKU,SDKU,4.6,0,0,state,0,0,,0,4.173,,,n.a.,Jan Oostergetel & Theodora Laurentius vs. The Slovak Republic,1,3,1,1,2,NLD,,0,n.a.,n.a.,n.a.,n.a.,UNCITRAL,Netherlands-Slovak Republic BIT,Textile enterprise,MFG,?_298m,352.9,yes,0,0,n.a.,n.a.,n.a.,n.a.
2004,TUN,2003,RCD,RCD,3.5,0,0,state,0,0,,NA,3.332,,,1/1 Q,Tanmiah v. Tunisia,NA,3,1,1,2,SAU,,0,n.a.,n.a.,n.a.,n.a.,AIC,Arab Investment Agreement,Broadcasting enterprise,SER,US$79058170,79.1,yes,0,0,no,n.a.,n.a.,n.a.
2009,TUR,2007,AKP,AKP,4,0,0,state,0,0,,0,4.243,,,ARB(AF)/07/2,Europe Cement Investment and Trade S.A. v. Republic of Turkey,1,0,NA,NA,NA,POL,,0,n.a.,n.a.,n.a.,n.a.,ICSID AF,Energy Charter Treaty,Electric power concession,UTL,US$3.8b,3800,yes,0,0,no,n.a.,n.a.,n.a.
2010,TUR,2007,AKP,AKP,4,0,0,state,0,0,,0,4.344,,4.445 (2011),ARB/07/20,Saba Fakes v. Republic of Turkey,1,0,NA,NA,NA,NLD,,0,n.a.,n.a.,n.a.,n.a.,ICSID,Netherlands-Turkey BIT,Telecommunications (mobile),TEL,unknown,unknown,yes,0,0,no,n.a.,n.a.,n.a.
2012,TUR,2008,AKP,AKP,4.1,0,0,state,0,0,,0,4.547,,4.445 (2011),ARB/08/13,Alapli Elektrik BV v. Republic of Turkey,1,0,NA,NA,NA,NLD,,0,n.a.,n.a.,n.a.,n.a.,ICSID,"Netherlands-Turkey BIT, Energy Charter Treaty",Electric power concession,UTL,US$100m,100,yes,0,0,yes,2012,2014,upheld
2014,TUR,2011,AKP,AKP,4.4,0,0,state,0,0,,0,4.751,,4.853 (2015),ARB/11/28,Tulip Real Estate and Development Netherlands B.V. v. Republic of Turkey,1,0,NA,NA,NA,NLD,,0,n.a.,n.a.,n.a.,n.a.,ICSID,Netherlands-Turkey BIT,Real estate (residential and commercial),RE,Approximately US$300m,300,yes,0,0,yes,2014,2015,upheld
2016,TUR,2014,AKP,AKP,4.7,0,0,state,0,0,,0,4.853,,4.853 (2015),(SCC Case No. 2014/023),Cem Uzan v. Republic of Turkey,1,0,NA,NA,NA,TUR,n.a.,0,n.a.,n.a.,n.a.,n.a.,SCC,Energy Charter Treaty,Electric power concession,UTL,US$2.5b,2500,no,n.a.,n.a.,n.a.,n.a.,n.a.,n.a.
