pending,VEN,2012,NA,PSUV,0.34,1,NA,pending,NA,NA,,1,NA,,,ARB(AF)/12/5,Rusoro Mining Ltd. v. Bolivarian Republic of Venezuela,0,n.a.,NA,NA,NA,CAN,n.a.,NA,n.a.,n.a.,n.a.,n.a.,ICSID AF,Canada-Venezuela BIT,Mining (gold),MIN,US$3.03b,3030,no,n.a.,n.a.,n.a.,n.a.,n.a.,n.a.
pending,VEN,2012,NA,PSUV,0.34,1,NA,pending,NA,NA,,1,NA,,,ARB/12/23,Tenaris S.A. and Talta - Trading e Marketing Sociedade Unipessoal Lda. v. Bolivarian Republic of Venezuela,0,n.a.,NA,NA,NA,PRT,n.a.,NA,BELLUX,n.a.,n.a.,n.a.,ICSID,"Luxembourg-Venezuela BIT, Portugal-Venezuela BIT",Steel production,MFG,unknown,unknown,no,n.a.,n.a.,n.a.,n.a.,n.a.,n.a.
pending,VEN,2012,NA,PSUV,0.34,1,NA,pending,NA,NA,,1,NA,,,ARB/12/18,Valle Verde Sociedad Financiera S.L. v. Bolivarian Republic of Venezuela,0,n.a.,NA,NA,NA,ESP,n.a.,NA,n.a.,n.a.,n.a.,n.a.,ICSID,Spain-Venezuela BIT,Banking,FIN,At least US$100m,100,no,n.a.,n.a.,n.a.,n.a.,n.a.,n.a.
pending,VEN,2012,NA,PSUV,0.34,1,NA,pending,NA,NA,,1,NA,,,ARB/12/13,Saint-Gobain Performance Plastics Europe v. Bolivarian Republic of Venezuela,0,n.a.,NA,NA,NA,FRA,n.a.,NA,n.a.,n.a.,n.a.,n.a.,ICSID,Venezuela-France BIT,Manufacturing (ceramics),MFG,unknown,unknown,no,n.a.,n.a.,n.a.,n.a.,n.a.,n.a.
pending,VEN,2012,NA,PSUV,0.34,1,NA,pending,NA,NA,,1,NA,,,3/1/2013,Seraf?_n Garc?_a Armas and Karina Garc?_a Gruber v. The Bolivarian Republic of Venezuela,0,n.a.,NA,NA,NA,ESP,n.a.,NA,n.a.,n.a.,n.a.,n.a.,PCA,Venezuela-Spain BIT,Manufacturing (food),MFG,unknown,unknown,no,n.a.,n.a.,n.a.,n.a.,n.a.,n.a.
pending,VEN,2012,NA,PSUV,0.34,1,NA,pending,NA,NA,,NA,NA,,,ARB/12/22,Venoklim Holding B.V. v. Bolivarian Republic of Venezuela,NA,n.a.,NA,NA,NA,NLD,n.a.,NA,n.a.,n.a.,n.a.,n.a.,ICSID,Netherlands-Venezuela BIT,Manufacturing (lubricants),MFG,unknown,unknown,no,n.a.,n.a.,n.a.,n.a.,n.a.,n.a.
pending,VEN,2013,NA,PSUV,0.36,1,NA,pending,NA,NA,,0,NA,,,ARB/13/11,"Valores Mundiales, S.L. and Consorcio Andino S.L. v. Venezuela",1,n.a.,NA,NA,NA,ESP,n.a.,NA,n.a.,n.a.,n.a.,n.a.,ICSID,Spain-Venezuela BIT,Manufacturing (tortillas and corn flour),MFG,unknown,unknown,no,n.a.,n.a.,n.a.,n.a.,n.a.,n.a.
pending,VEN,2014,NA,PSUV,0.38,1,NA,pending,NA,NA,,0,NA,,,ARB/14/10,"Highbury International AVV, Compania Minera de Bajo Caron AVV, and Ramstein Trading Inc. v. Bolivarian Republic of Venezuela",1,n.a.,NA,NA,NA,NLD,n.a.,NA,PAN,n.a.,n.a.,n.a.,ICSID,"Venezuela-Netherlands BIT, Venezuela Investment Law (1999)",Mining,MIN,unknown,unknown,no,n.a.,n.a.,n.a.,n.a.,n.a.,n.a.
pending,VEN,2014,NA,PSUV,0.38,1,NA,pending,NA,NA,,NA,NA,,,ARB(AF)/14/1,Anglo American PLC v. Bolivarian Republic of Venezuela,NA,n.a.,NA,NA,NA,GBR,n.a.,NA,n.a.,n.a.,n.a.,n.a.,ICSID,UK-Venezuela BIT,Mining,MIN,unknown,unknown,no,n.a.,n.a.,n.a.,n.a.,n.a.,n.a.
pending,VEN,2006,NA,MVR,0.5,1,NA,pending,NA,NA,,1,NA,,,ARB/06/4,Vestey Group Ltd v. Bolivarian Republic of Venezuela,0,n.a.,NA,NA,NA,GBR,n.a.,NA,n.a.,n.a.,n.a.,n.a.,ICSID,"United Kingdom-Venezuela BIT, Venezuela Investment Law (1999)",Agricultural enterprise,AGR,unknown,unknown,no,n.a.,n.a.,n.a.,n.a.,n.a.,n.a.
2015,ZWE,2010,ZANU-PF,ZANU-PF,1.286,1,1,pending,NA,NA,,1,1.785,,1.477 (2013),ARB/10/25,"Border Timbers Limited, Border Timbers International (Private) Limited, and Hangani Development Co. (Private) Limited v. Republic of Zimbabwe",0,n.a.,NA,NA,NA,CHE,n.a.,1,n.a.,n.a.,n.a.,n.a.,ICSID,Switzerland-Zimbabwe BIT,Agricultural enterprise (forestry),AGR,unknown,unknown,no,n.a.,n.a.,yes,2015,pending,pending
pending,ZWE,2010,NA,ZANU-PF,1.286,1,NA,pending,NA,NA,,1,NA,,,ARB/10/15,Bernhard von Pezold and others v. Republic of Zimbabwe,0,n.a.,NA,NA,NA,DEU,n.a.,NA,n.a.,n.a.,n.a.,n.a.,ICSID,"Germany-Zimbabwe BIT, Switzerland-Zimbabwe BIT",Agricultural enterprise,AGR,unknown,unknown,no,n.a.,n.a.,n.a.,n.a.,n.a.,n.a.
pending,BIH,2014,NA,NA,NA,NA,NA,pending,NA,NA,,NA,NA,,,ARB/14/13,Elektrogospodarstvo Slovenije - razvoj ininzeniring d.o.o. v. Bosnia and Herzegovina,NA,n.a.,NA,NA,NA,SVN,n.a.,NA,n.a.,n.a.,n.a.,n.a.,ICSID,"Bosnia and Herzegovina-Slovenia BIT, Energy Charter Treaty",Electric power concession (thermal),UTL,unknown,unknown,no,n.a.,n.a.,n.a.,n.a.,n.a.,n.a.
pending,BLZ,2009,NA,UDP,NA,NA,NA,pending,NA,NA,,NA,NA,,,n.a.,British Caribbean Bank (BCB) v. Belize,NA,n.a.,NA,NA,NA,GBR,n.a.,NA,n.a.,n.a.,n.a.,n.a.,PCA,UK-Belize BIT,Telecommunications,TEL,unknown,unknown,no,n.a.,n.a.,n.a.,n.a.,n.a.,n.a.
pending,JOR,2013,NA,independent,NA,NA,NA,pending,NA,NA,,0,NA,,,ARB/13/38,Fouad Alghanim & Sons Co. and others v. Jordan,1,n.a.,NA,NA,NA,KWT,n.a.,NA,n.a.,n.a.,n.a.,n.a.,ICSID,Jordan-Kuwait BIT,Telecommunications,TEL,unknown,unknown,no,n.a.,n.a.,n.a.,n.a.,n.a.,n.a.
pending,JOR,2015,NA,independent,NA,NA,NA,pending,NA,NA,,NA,NA,,,ARB/15/24,Ali Alyafei v. Hashemite Kingdom of Jordan,NA,n.a.,NA,NA,NA,QAT,n.a.,NA,ITA,n.a.,n.a.,n.a.,ICSID,Leauge of Arab States Investment,Finance (financial services),FIN,unknown,unknown,no,n.a.,n.a.,n.a.,n.a.,n.a.,n.a.
pending,JOR,2015,NA,independent,NA,NA,NA,pending,NA,NA,,NA,NA,,,ARB/15/10,Orange SA v. Hashemite Kingdom of Jordan,NA,n.a.,NA,NA,NA,FRA,n.a.,NA,n.a.,n.a.,n.a.,n.a.,ICSID,France-Jordan BIT,Telecommunications ,TEL,unknown,unknown,no,n.a.,n.a.,n.a.,n.a.,n.a.,n.a.
pending,LBN,2015,NA,independent,NA,NA,NA,pending,NA,NA,,NA,NA,,,ARB/15/3,Abed El Jaouni and Imperial Holding SAL v. Lebanese Republic,NA,n.a.,NA,NA,NA,DEU,n.a.,NA,n.a.,n.a.,n.a.,n.a.,ICSID,Germany-Lebanon BIT,Transportation (air),UTL,unknown,unknown,no,n.a,n.a.,n.a.,n.a.,n.a.,n.a.
pending,LBY,2015,NA,independent,NA,NA,NA,pending,NA,NA,,0,NA,,,ARB(AF)/15/1,Strabag SE v. Libya,1,n.a.,NA,NA,NA,AUT,n.a.,NA,n.a.,n.a.,n.a.,n.a.,ICSID AF,Austria-Libya BIT,Construction,UTL,unknown,unknown,no,n.a.,n.a.,n.a.,n.a.,n.a.,n.a.
pending,LCA,2012,NA,SLP,NA,NA,NA,pending,NA,NA,,NA,NA,,,ARB/12/10,RSM Production Corporation v. Saint Lucia,NA,n.a.,NA,NA,NA,USA,n.a.,NA,n.a.,n.a.,n.a.,n.a.,ICSID,Contract with host state,Oil and gas,OIL,unknown,unknown,no,n.a.,n.a.,n.a.,n.a.,n.a.,n.a.
pending,LTU,2012,NA,independent,NA,NA,NA,pending,NA,NA,,NA,NA,,,n.a.,Vladimir Antonov v. Republic of Lithuania,NA,n.a.,NA,NA,NA,RUS,n.a.,NA,n.a.,n.a.,n.a.,n.a.,ICC,Lithuania-Russian Federation BIT,unknown,unknown,unknown,unknown,no,n.a.,n.a.,n.a.,n.a.,n.a.,n.a.
pending,LTU,2012,NA,independent,NA,NA,NA,pending,NA,NA,,NA,NA,,,n.a.,OAO Gazprom v. Lithuania,NA,n.a.,NA,NA,NA,RUS,n.a.,NA,n.a.,n.a.,n.a.,n.a.,UNCITRAL,Lithuania-Russian Federation BIT,Oil and gas (distribution),OIL,unknown,unknown,no,n.a.,n.a.,n.a.,n.a.,n.a.,n.a.
pending,LTU,2014,NA,independent,NA,NA,NA,pending,NA,NA,,NA,NA,,,n.a., R.S.E. Holdings v. Latvia ,NA,n.a.,NA,NA,NA,CHE,n.a.,NA,n.a.,n.a.,n.a.,n.a.,ad hoc,Switzerland-Latvia BIT,Banking ,FIN,unknown,unknown,no,n.a.,n.a.,n.a.,n.a.,n.a.,n.a.
pending,LTU,2014,NA,independent,NA,NA,NA,pending,NA,NA,,NA,NA,,,n.a.,LLC Winergy v. Latvia,NA,n.a.,NA,NA,NA,EST,n.a.,NA,n.a.,n.a.,n.a.,n.a.,PCA,Latvia-Estonia BIT,Electric power concession (wind),UTL,unknown,unknown,no,n.a.,n.a.,n.a.,n.a.,n.a.,n.a.
pending,MDG,2013,NA,TGV,NA,NA,NA,pending,NA,NA,,NA,NA,,,ARB/13/34,Courts (Indian Ocean) Limited and Courts Madagascar S.A.R.L. v. Mauritius,NA,n.a.,NA,NA,NA,MUS,n.a.,NA,n.a.,n.a.,n.a.,n.a.,ICSID,Mauritius-Madagascar BIT,Retail,SER,unknown,unknown,no,n.a.,n.a.,n.a.,n.a.,n.a.,n.a.
pending,MNE,2014,NA,NA,NA,NA,NA,pending,NA,NA,,0,NA,,,ARB/14/8,CEAC Holdings Limited v. Montenegro (parallel under UNCITRAL),1,n.a.,NA,NA,NA,CYP,n.a.,NA,n.a.,n.a.,n.a.,n.a.,ICSID,Cyprus-Montenegro BIT,Aluminum (bauxite),MIN,US$1362m,1362,no,n.a.,n.a.,n.a.,n.a.,n.a.,n.a.
pending,MNE,2012,NA,NA,NA,NA,NA,pending,NA,NA,,1,NA,,,ARB(AF)/12/8,MNSS B.V. and Recupero Credito Acciaio N.V. v. Montenegro,0,n.a.,NA,NA,NA,NLD,n.a.,NA,n.a.,n.a.,n.a.,n.a.,ICSID AF,Montenegro-Netherlands BIT; Montenegro Investment Law (2011),Steel production,MFG,EUR72m,90,no,n.a.,n.a.,n.a.,n.a.,n.a.,n.a.
pending,MNE,2013,NA,NA,NA,NA,NA,pending,NA,NA,,NA,NA,,,n.a.,Central European Aluminium Company (CEAC Holdings Limited) v. Montenegro (parallel at ICSID),NA,n.a.,NA,NA,NA,CYP,n.a.,NA,n.a.,n.a.,n.a.,n.a.,UNCITRAL,Contract with host state,Aluminum (bauxite),MIN,US$1362m,1362,no,n.a.,n.a.,n.a.,n.a.,n.a.,n.a.
pending,OMN,2015,NA,independent,NA,NA,NA,pending,NA,NA,,NA,NA,,,ARB/15/30,"Samsung Engineering Co., Ltd. v. Sultanate of Oman",NA,n.a.,NA,NA,NA,KOR,n.a.,NA,n.a.,n.a.,n.a.,n.a.,ICSID,Republic of Korea-Oman BIT,Oil and gas,OIL,unknown,unknown,no,n.a.,n.a.,n.a.,n.a.,n.a.,n.a.
pending,PER,2014,NA,Gana Peru,NA,NA,NA,pending,NA,NA,Alliance,1,NA,,,ARB/14/21,Bear Creek Mining Corporation v. Republic of Peru,0,n.a.,NA,NA,NA,CAN,n.a.,NA,n.a.,n.a.,n.a.,n.a.,ICSID,Canada-Peru FTA,Mining (silver),MIN,unknown,unknown,no,n.a.,n.a.,n.a.,n.a.,n.a.,n.a.
pending,PER,2012,NA,Gana Peru,NA,NA,NA,pending,NA,NA,Alliance,NA,NA,,,ARB/12/28,Pluspetrol Peru Corporation and others v. Perupetro S.A.,NA,n.a.,NA,NA,NA,USA,n.a.,NA,n.a.,n.a.,n.a.,n.a.,ICSID,Contract with host state,Oil and gas,OIL,unknown,unknown,no,n.a.,n.a.,n.a.,n.a.,n.a.,n.a.
pending,PNG,2013,NA,PNC,NA,NA,NA,pending,NA,NA,PNP,0,NA,,,ARB/13/33,PNG Sustainable Development Program Ltd. v. Independent State of Papua New Guinea,1,n.a.,NA,NA,NA,SGP,n.a.,NA,n.a.,n.a.,n.a.,n.a.,ICSID,Papua New Guinea Investment Law,Mining (gold and copper),MIN,unknown,unknown,no,n.a.,n.a.,n.a.,n.a.,n.a.,n.a.
pending,ROM,2012,NA,independent,NA,NA,NA,pending,NA,NA,,0,NA,,,ARB/12/25,Marco Gavazzi and Stefano Gavazzi v. Romania,1,n.a.,NA,NA,NA,ITA,n.a.,NA,n.a.,n.a.,n.a.,n.a.,ICSID,Italy-Romania BIT,Steel production,MFG,unknown,unknown,no,n.a.,n.a.,n.a.,n.a.,n.a.,n.a.
pending,ROM,2014,NA,independent,NA,NA,NA,pending,NA,NA,,NA,NA,,,ARB/14/28,Alpiq AG v. Romania,NA,n.a.,NA,NA,NA,CHE,n.a.,NA,n.a.,n.a.,n.a.,n.a.,ICSID,"Romania-Switzerland BIT, Energy Charter Treaty",Electric power concession,UTL,unknown,unknown,no,n.a.,n.a.,n.a.,n.a.,n.a.,n.a.
pending,ROM,2014,NA,independent,NA,NA,NA,pending,NA,NA,,NA,NA,,,ARB/14/29,"Ioan Micula, Viorel Micula and others v. Romania",NA,n.a.,NA,NA,NA,SWE,n.a.,NA,n.a.,n.a.,n.a.,n.a.,ICSID,Sweden-Romania BIT,Beverage production enterprise,MFG,unknown,unknown,no,n.a.,n.a.,n.a.,n.a.,n.a.,n.a.
pending,ROM,2015,NA,independent,NA,NA,NA,pending,NA,NA,,NA,NA,,,ARB/15/31,Gabriel Resources Ltd. and Gabriel Resources (Jersey) v. Romania,NA,n.a.,NA,NA,NA,GBR,n.a.,NA,CAN,n.a.,n.a.,n.a.,ICSID,Canada-Romania BIT and Romania-United Kingdom BIT,Mining (gold),MIN,At least US$500000000,500,no,n.a.,n.a.,n.a.,n.a.,n.a.,n.a.
pending,SRB,2013,NA,NA,NA,NA,NA,pending,NA,NA,,NA,NA,,,n.a.,Mytilineos Holdings v. Serbia,NA,n.a.,NA,NA,NA,GRC,n.a.,NA,n.a.,n.a.,n.a.,n.a.,UNCITRAL,Greece-Serbia BIT,Mining,MIN,unknown,unknown,no,n.a.,n.a.,n.a.,n.a.,n.a.,n.a.
pending,SRB,2014,NA,NA,NA,NA,NA,pending,NA,NA,,NA,NA,,,ARB/14/27,Zelena N.V. and Energo-Zelena d.o.o Indija v. Republic of Serbia,NA,n.a.,NA,NA,NA,BELLUX,n.a.,NA,n.a.,n.a.,n.a.,n.a.,ICSID,Belgium & Luxembourg-Serbia BIT,Waste management,SER,unknown,unknown,no,n.a.,n.a.,n.a.,n.a.,n.a.,n.a.
pending,SSD,2012,NA,NA,NA,NA,NA,pending,NA,NA,,NA,NA,,,ARB/12/26,Sudapet Company Limited v. Republic of South Sudan,NA,n.a.,NA,NA,NA,SDN,n.a.,NA,n.a.,n.a.,n.a.,n.a.,ICSID,South Sudan Investment Law (2009),Exploration and production of hydrocarbons,OIL,US$1.2b,1200,no,n.a.,n.a.,n.a.,n.a.,n.a.,n.a.
pending,TUN,2012,NA,independent,NA,NA,NA,pending,NA,NA,,NA,NA,,,ARB/12/30,Lundin Tunisia B. V. v. Republic of Tunisia,NA,n.a.,NA,NA,NA,SWE,n.a.,NA,n.a.,n.a.,n.a.,n.a.,ICSID,Contract with host state,Oil and gas (exploration),OIL,unknown,unknown,no,n.a.,n.a.,n.a.,n.a.,n.a.,n.a.
pending,UKR,2015,NA,independent,NA,NA,NA,pending,NA,NA,,NA,NA,,,ARB/15/33,Gilward Investments B.V. v. Ukraine,NA,n.a.,NA,NA,NA,NLD,n.a.,NA,n.a.,n.a.,n.a.,n.a.,ICSID,Netherlands-Ukraine BIT,Transportation (air),UTL,unknown,unknown,no,n.a.,n.a.,n.a.,n.a.,n.a.,n.a.
pending,UKR,2015,NA,independent,NA,NA,NA,pending,NA,NA,,NA,NA,,,n.a.,"Littop Enterprises Limited, Bridgemont Ventures Limited and Bordo Management Limited v. Ukraine",NA,n.a.,NA,NA,NA,CYP,n.a.,NA,n.a.,n.a.,n.a.,n.a.,SCC,Ukraine-Cyprus BIT,Electric power concession,UTL,US$5000m,5000,no,n.a.,n.a.,n.a.,n.a.,n.a.,n.a.
pending,UKR,2015,NA,independent,NA,NA,NA,pending,NA,NA,,NA,NA,,,n.a.,"Littop Enterprises Limited, Bridgemont Ventures Limited and Bordo Management Limited v. Ukraine",NA,n.a.,NA,NA,NA,CYP,n.a.,NA,n.a.,n.a.,n.a.,n.a.,ECA,Ukraine-Cyprus BIT,Electric power concession,UTL,US$5000m,5000,no,n.a.,n.a.,n.a.,n.a.,n.a.,n.a.
pending,URY,2010,NA,independent,NA,NA,NA,pending,NA,NA,,0,NA,,,ARB/10/7,"Philip Morris Brands Sarl (Switzerland), Philip Morris Products S.A. (Switzerland) and Abal Hermanos S.A. (Uruguay) v. Oriental Republic of Uruguay (formerly FTR Holding SA, Philip Morris Products S.A. and Abal Hermanos S.A. v. Oriental Republic of Uruguay)",1,n.a.,NA,NA,NA,CHE,n.a.,NA,n.a.,n.a.,n.a.,n.a.,ICSID,Switzerland-Uruguay BIT,"Manufacturing (cigarettes, tobacco)",MFG,US$2000m,2000m,no,n.a.,n.a.,n.a.,n.a.,n.a.,n.a.
pending,YUG,2009,NA,NA,NA,NA,NA,pending,NA,NA,,NA,NA,,,ARB/09/21,"UAB ""ARVI"" ir ko & UAB ""SANITEX"" v. Republic of Serbia",NA,n.a.,NA,NA,NA,LTU,n.a.,NA,n.a.,n.a.,n.a.,n.a.,ICSID,"Lithuania-Montenegro BIT, Serbia-Lithuania BIT",Manufacturing (fertilizer),MFG,?_50m,63.7,no,n.a.,n.a.,n.a.,n.a.,n.a.,n.a.
pending,ARG,2009,NA,FPV,1.727,1,NA,pending,,0,,0,NA,,,ARB/09/1,"Claims arising out of the alleged expropriation and unlawful revocation of aviation licenses by the Lebanese government from the claimant's subsidiary, ImperialJet.",1,n.a.,NA,NA,NA,ESP,n.a.,NA,n.a.,n.a.,n.a.,n.a.,ICSID,Argentina-Spain BIT,Aviation,SER,unknown,unknown,no,n.a.,n.a.,n.a.,n.a.,n.a.,n.a.
2007,ARG,1997,FPV,PJ,3.727,0,1,investor,1,0,,0,1.554,,,ARB/97/3,Compania de Aguas del Aconquija S.A. and Vivendi Universal v. Argentine Republic,1,3,1,1,2,FRA,,0,n.a.,n.a.,n.a.,n.a.,ICSID,"Argentina-France BIT, Contract",Water and sewage concession,UTL,US$316m plus interest,316,yes,"US$105m, no legal fees specified",105,yes,2001,2010,upheld
2009,BGD,2005,AL,BNP,4.329,0,1,investor,1,0,,0,2.964,,,ARB/05/7,Saipem SpA v. People's Republic of Bangladesh,1,0,NA,NA,NA,ITA,,0,n.a.,n.a.,n.a.,n.a.,ICSID,Bangladesh-Italy BIT,Oil and gas (distribution),OIL,unknown,unknown,yes,"US$6m, plus interest (each party to pay their legal costs and split the costs of arbitration)",6,no,n.a.,n.a.,n.a.
2006,BGR,2001,BSP,SDS,4.75,0,NA,investor,1,0,4.75 (1994),NA,NA,,NA,n.a.,Zeevi Holdings v Bulgaria and The Privatization Agency of Bulgaria,NA,0,NA,NA,NA,ISR,,0,n.a.,n.a.,n.a.,n.a.,UNCITRAL,Contract with host state,Aviation,SER,Over US$50m,50,yes,US$23150000 (legal costs to be split by the parties),23,n.a.,n.a.,n.a.,n.a.
2002,CAN,1998,LPC,LPC,3.333,0,1,investor,1,0,,0,2.134,,2.134 (2005),n.a.,S.D. Myers Inc. v. Canada,1,3,1,1,2,USA,,0,n.a.,n.a.,n.a.,n.a.,UNCITRAL,NAFTA,Import/Export (PCB waste),SER,US$53m,53,yes,"CAD6050000, plus interest",3.9,n.a.,n.a.,n.a.,n.a.
2002,CAN,1999,LPC,LPC,3.333,0,1,investor,1,0,,0,2.134,,2.134 (2005),n.a.,Pope & Talbot v. Canada,1,3,1,1,2,USA,,0,n.a.,n.a.,n.a.,n.a.,UNCITRAL,NAFTA,Agricultural enterprise (lumber),AGR,US$507m,507,yes,"US$461566, plus interest (from 31 May 2002 until payment at 5% per annum, compounded quarterly)",0.5,n.a.,n.a.,n.a.,n.a.
2016,CAN,2013,LPC,CPC,4.667,0,1,investor,1,0,,0,2.134,,2.134 (2017),(PCA Case No. 2013-22),Windstream Energy LLC v. Canada,1,3,1,1,2,USA,,0,n.a.,n.a.,n.a.,n.a.,UNCITRAL,NAFTA,Electric power concession (wind),UTL,CAD475m,478.2,no,n.a.,n.a.,n.a.,n.a.,n.a.,n.a.
2010,CAN,2010,CPC,CPC,4.667,0,0,investor,1,0,,1,4.181,,,UNCT/10/1,AbitibiBowater Inc. v. Government of Canada,0,1,0,0,0,USA,,0,n.a.,n.a.,n.a.,n.a.,ICSID UNCITRAL,NAFTA,Electric power power concession (hydro),UTL,CAD500m,467.5,yes,CAD130m,123,no,n.a.,n.a.,n.a.
2012,CRI,2009,PLN,PLN,3.583,0,0,investor,1,0,,0,3.385,,,ARB/09/20,Reinhard Hans Unglaube v. Republic of Costa Rica,1,3,1,1,2,DEU,,0,n.a.,n.a.,n.a.,n.a.,ICSID,Costa-Rica Germany BIT,Tourism (ecotourism),SER,US$8.8m,8.8,yes,"US$3.1m, plus interest to the day of the award raising award to US$4065900.33 (parties to pay their own legal fees and arbitration costs split)",4.1,no,n.a.,n.a.,n.a.
2012,CRI,2008,PLN,PLN,3.833,0,0,investor,1,0,,0,3.385,,,ARB/08/1,Marion Unglaube v. Republic of Costa Rica,1,3,1,1,2,DEU,,0,n.a.,n.a.,n.a.,n.a.,ICSID,Costa Rica-Germany BIT,Tourism,SER,unknown,unknown,yes,"US$3.1m, plus interest to total US$4.07m (parties pay their own legal fees, costs of arbitration split)",3.1,no,n.a.,n.a.,n.a.
2000,CRI,1996,PUSC,PLN,3.833,0,0,investor,1,0,,0,4.292,,,ARB/96/1,Compania del Desarrollo de Santa Elena SA v. Republic of Costa Rica,1,1,0,0,0,USA,,0,n.a.,n.a.,n.a.,n.a.,ICSID,Contract with host state,Real estate,RE,US$41200000,41.2,yes,"US$16m, each party to pay the costs of arbitration",16,no,n.a.,n.a.,n.a.
2008,CZE,1996,ODS,ODS/KDS,4.857,0,0,investor,1,0,ODS (1996),NA,4.298,,,n.a.,Diag Human S.E. v. The Czech Republic,NA,0,NA,NA,NA,LIE,,0,n.a.,n.a.,n.a.,n.a.,ad hoc,Contract with host state,Health services (Blood treatment & processing facility),SER,unknown,unknown,yes,US$650m,650,no,n.a.,n.a.,n.a.
2004,ECU,2002,PSP,DP,3.5,0,1,investor,1,0,UDC/DP (DP became UDC in 2013),0,2.553,,,UN3467,Occidental Exploration and Production Company v. Republic of Ecuador,1,0,NA,NA,NA,USA,,0,n.a.,n.a.,n.a.,n.a.,LCIA,Ecuador-United States BIT,Oil and gas (exploration),OIL,"US$201,563,930",201.6,yes,"US$71533649, plus simple interest (of US$3541280 to 1 January 2004), plus simple interest (of 2.75% to date of award). Each party to pay their legal fees. Respondent to pay 55% of Claimant's cost of arbitration.",75.1,n.a.,n.a.,n.a.,n.a.
2004,ECU,2001,PSP,DP,3.5,0,1,investor,1,0,,NA,2.553,,,ARB/01/10,Repsol YPF Ecuador SA v. Republic of Ecuador and Empresa Estatal Petr??leos del Ecuador (PetroEcuador),NA,0,NA,NA,NA,ESP,,0,n.a.,n.a.,n.a.,n.a.,ICSID,Contract with host state,Oil and gas (exploration),OIL,unknown,unknown,yes,US$13684279.23,13.7,yes,2004,2007,upheld
2000,EGY,1998,NDP,NDP,4.25,0,0,investor,1,0,,0,4.19,,,ARB/98/4,Wena Hotels Ltd. v. Egypt,1,0,NA,NA,NA,GBR,,0,n.a.,n.a.,n.a.,n.a.,ICSID,Egypt-United Kingdom BIT,Tourism (hotel),SER,Not less than US$62820000,62.8,yes,"US$20600986.43 including damages, interest, attorneys' fees and expenses",20.6,yes,2001,2002,upheld
2002,EGY,1999,NDP,NDP,4.25,0,0,investor,1,0,,0,4.19,,,ARB/99/6,Middle East Cement Shipping and Handling Co. v. Arab Republic of Egypt,1,0,NA,NA,NA,GRC,,0,n.a.,n.a.,n.a.,n.a.,ICSID,Egypt-Greece BIT,Manufacturing (cement),MFG,US$42m plus compound interest,42,yes,"US$2,190,430 awarded plus US$1,558,970 in compound interest up to date of award, plus interest at 6% compounded annually until payment; legal fees unclear (award in French)",2.2,no,n.a.,n.a.,n.a.
2007,EGY,2002,NDP,NDP,4.25,0,0,investor,1,0,,0,4.19,,,ARB/02/15,"Ahmonseto Inc., et al v. Arab Republic of Egypt",1,0,NA,NA,NA,USA,,0,n.a.,n.a.,n.a.,n.a.,ICSID,Egypt-United States BIT,Textile enterprise,MFG,US$250m,250,yes,unknown,unknown,yes,2007,2010,discontinued
2015,EGY,2011,FJP,NDP,4.25,0,1,investor,1,0,,1,1.865,,1.865 (2011),ARB/11/32,Indorama International Finance Limited v. Arab Republic of Egypt,0,0,NA,NA,NA,GBR,,1,n.a.,n.a.,n.a.,n.a.,ICSID,Egypt-United Kingdom BIT,Textile enterprise,MFG,US$156,156,yes,US$54,54,none,n.a.,n.a.,n.a.
2009,EGY,2005,NDP,NDP,4.25,0,0,investor,1,0,,1,4.19,,,ARB/05/15,Waguih Elie George Siag & Clorinda Vecchi v. Arab Republic of Egypt,0,0,NA,NA,NA,ITA,,0,n.a.,n.a.,n.a.,n.a.,ICSID,Egypt-Italy BIT,Tourism (resort),SER,unknown,unknown,yes,US$74.5m plus interest and legal costs,74.5,yes,2009,2010,upheld
2000,ESP,1997,PP,PP,4.45,0,0,investor,1,0,,0,4.398,,,ARB/97/7,Emilio Agustin Maffezini v. Kingdom of Spain,1,1,0,0,0,ARG,,0,n.a.,n.a.,n.a.,n.a.,ICSID,Argentina-Spain BIT,Manufacturing (chemical products),MFG,"Spanish Pesetas 30m, plus interest",0.1,yes,"Spanish Pesetas 30 million awarded plus interest 27,641,265.28. Total award was 57,641,265.28 Spanish Pesetas (equivalent to US$96,597), each party to pay their legal fees",0.05,no,n.a.,n.a.,n.a.
2007,EST,2004,SDE,ERL,3.6,0,1,investor,1,0,ERa,0,2.002,,,ARB/04/6,OKO Osuuspankkien Keskuspankki Oyj and others v. Republic of Estonia,1,0,NA,NA,NA,DEU,,0,FIN,n.a.,n.a.,n.a.,ICSID,"Estonia-Germany BIT, Estonia-Finland BIT",Banking,FIN,At least US$4m and DEM21.9m,32,yes,"Enumerate award in two parts: US$4.4m and ?_8.3m, plus interest (Respondent to pay Claimant's legal costs and share of arbitration costs)",15.4,no,n.a.,n.a.,n.a.
2007,FRA,2003,UMP,UMP,4.9,0,0,investor,1,0,5(2002),NA,4.302,,,IIC 58,Eurotunnel Group v. France & United Kingdom,NA,1,0,0,0,FRA,,0,GBR,n.a.,n.a.,n.a.,PCA,Treaty of Canterbury,Transportation (rail),UTL,US$1b,1000,yes,unknown,unknown,no,n.a.,n.a.,n.a.
2008,GEO,2005,UNM,UNM,4.571,0,0,investor,1,0,,0,4.433,,,ARB/05/23,Ares International Srl and MetalGeo Srl v. Georgia,1,0,NA,NA,NA,ITA,,0,n.a.,n.a.,n.a.,n.a.,ICSID,Georgia-Italy BIT,Steel production,MFG,unknown,unknown,yes,"US$90m, plus interest",90,no,n.a.,n.a.,n.a.
2010,GEO,2005,UNM,UNM,4.571,0,0,investor,1,0,,1,4.155,,,ARB/05/18,Ioannis Kardossopoulos v. Georgia,0,0,NA,NA,NA,GRC,,0,n.a.,n.a.,n.a.,n.a.,ICSID,"Georgia-Greece BIT, Energy Charter Treaty",Oil and gas,OIL,US$350m,350,yes,"US$15.12m, plus interest and legal fees",15.1,yes,2010,2011,upheld
2010,GEO,2007,UNM,UNM,4.571,0,0,investor,1,0,,1,4.155,,,ARB/07/15 [joined to ARB/05/18],Ron Fuchs v. Republic of Georgia,0,0,NA,NA,NA,ISR,,0,n.a.,n.a.,n.a.,n.a.,ICSID,Georgia-Israel BIT,Oil and gas,OIL,Enumerated two claims: US$15.1m plus $3m,18,yes,"US$15.12m, plus interest and legal fees",15.1,yes,2010,2011,discontinued
2012,GEO,2008,UNM,UNM,4.571,0,0,investor,1,0,,NA,3.876,,,ARB/08/19,Karmer Marble Tourism Construction Industry & Commerce Limited Liability v. Georgia,NA,0,NA,NA,NA,TUR,,0,n.a.,n.a.,n.a.,n.a.,ICSID,Georgia-Turkey BIT,Highway construction project,UTL,unknown,unknown,yes,unknown,unknown,yes,2012,2013,discontinued
2012,GTM,2007,PP,GANA,4.5,0,0,investor,1,0,,0,4.92,,,ARB/07/23,Railroad Development Corporation v. Republic of Guatemala,1,1,0,0,0,USA,,0,n.a.,n.a.,n.a.,n.a.,ICSID,CAFTA-DR,Transportation (rail),UTL,US$65m,65,yes,"Award enumerated in three parts: US$6.57m, US$1.35m, and US$3.38m. Plus compound interest and administrative fees (of US$385k plus US$192k).",11.3,no,n.a.,n.a.,n.a.
2000,HND,1999,PL,PL,4,0,0,investor,1,0,,NA,3.905,,,ARB/99/8,Astaldi SpA & Columbus Latinoamericana de Construcciones SA v. Republic of Honduras,NA,1,0,0,0,ITA,,0,PAN,n.a.,n.a.,n.a.,ICSID,Contract with host state,Highway construction project,UTL,unknown,unknown,yes,settlement,settlement,n.a.,n.a.,n.a.,n.a.
2010,HND,2007,PN,PL,4.125,0,0,investor,1,0,,NA,4.432,,4.338 (2009),ARB/07/32,Astaldi SpA v. Republic of Honduras,NA,1,0,0,0,ITA,,0,n.a.,n.a.,n.a.,n.a.,ICSID,Contract with host state,Highway construction project,UTL,unknown,unknown,yes,"US$5.48m, plus interests and legal costs",5.5,yes,2011,2011,discontinued
2012,HND,2009,PN,PL,4.5,0,0,investor,1,0,,NA,4.619,,4.713 (2013),ARB/09/4,Elsamex v. Honduras,NA,1,0,0,0,ESP,,0,n.a.,n.a.,n.a.,n.a.,ICSID,Contract with host state,Highway construction project,UTL,unknown,unknown,yes,US$8m,8,yes,2013,pending,pending
2010,IND,2010,INC,PD,3.167,0,1,investor,1,0,,0,2.574,,,n.a.,White Industries Australia Limited v. The Republic of India,1,3,1,1,2,AUS,,0,n.a.,n.a.,n.a.,n.a.,UNCITRAL,Australia-India BIT,Mining (coal),MIN,US$8.7m,8.7,yes,US$4m,4,no,n.a.,n.a.,n.a.
2008,KAZ,2005,Otan,Otan,3.111,0,1,investor,1,0,NO,0,2.862,,2.821 (2007),ARB/05/16,Rumeli Telekom AS & Telsim Mobil Telekomunikasyon Hizmetleri AS v. Republic of Kazakhstan,1,2,1,NA,1,TUR,,0,n.a.,n.a.,n.a.,n.a.,ICSID,"Kazakhstan-Turkey BIT, Kazakhastan investment Law (1994)",Telecommunications,TEL,Up to US$458m,458,yes,"US$125m, plus interest and legal fees",125,yes,2008,2010,upheld
2005,KGZ,2003,UDF,UDF,3.25,0,0,investor,1,0,Union of Democratic Forces (SDS); 3.25 (2000),0,4.188,,4.202 (2004),126/2003,Petrobart v. Kyrgyzstan,1,1,0,0,0,GIB,,0,n.a.,n.a.,n.a.,n.a.,SCC,Energy Charter Treaty,Oil and gas,OIL,US$4084651 plus interest,4.1,yes,"US$1130859, plus interest (each party to pay their own legal fees)",1.1,n.a.,n.a.,n.a.,n.a.
1990,LKA,1987,UNP,UNP,4.45,0,0,investor,1,0,,0,4.372,,4.324 (1989),ARB/87/3,Asian Agricultural Products Ltd. (AAPL) v. Republic of Sri Lanka,1,2,1,NA,1,GBR,,0,n.a.,n.a.,n.a.,n.a.,ICSID,Sri Lanka-United Kingdom BIT,Agricultural enterprise (fishing),AGR,US$8m,8,yes,0.46m,0.46,no,n.a.,n.a.,n.a.
2000,LVA,1999,TB/LNNK,TB/LNNK,3.812,0,0,investor,1,0,,0,4.051,,,n.a.,Swembalt AB v. Latvia,1,1,0,0,0,SWE,,1,n.a.,n.a.,n.a.,n.a.,UNCITRAL,Latvia-Sweden BIT,Salvage,SER,US$2806258 plus interest and costs,2.8,yes,"US$2,506,235 awarded plus 10% annual interest starting 9 Apr 1999; legal fees unclear; Award unsuccessfully challenged in Swedish courts",2.5,n.a.,n.a.,n.a.,n.a.
2003,LVA,2001,ZZS,TB/LNNK,3.937,0,0,investor,1,0,,0,3.04,,,n.a.,Nykomb Synergetics v. Latvia,1,2,1,NA,1,SWE,,0,n.a.,n.a.,n.a.,n.a.,SCC,Energy Charter Treaty,Electric power concession,UTL,Approximately US$12.8m,12.8,yes,"Latvian Lats 1600000, plus interest",3,n.a.,n.a.,n.a.,n.a.
2013,MDA,2011,independent,PDM,3.083,0,NA,investor,1,0,,0,NA,,,ARB/11/23,Mr. Franck Charles Arif v. Republic of Moldova,1,-999,NA,NA,NA,FRA,,NA,n.a.,n.a.,n.a.,n.a.,ICSID,France-Moldova BIT,Retail (duty free stores),SER,"Range: Between ?_21.5m and ?_38.3m, plus interest",28.8,yes,Moldovan Lei 35136294,1.7,no,n.a.,n.a.,n.a.
2013,MDA,2010,independent,PL,4.667,0,NA,investor,1,0,,0,NA,,,n.a.,Energoalians SARL v. Republic of Moldova,1,-999,NA,NA,NA,UKR,,NA,n.a.,n.a.,n.a.,n.a.,UNCITRAL,"Moldova-Ukraine BIT, Energy Charter Treaty",Electric power concession,UTL,unknown,unknown,yes,US$49m,49,n.a.,n.a.,n.a.,n.a.
2003,MEX,2000,PAN,PRI,3.727,0,0,investor,1,0,,0,4.767,,,ARB(AF)/00/2,Tecnicas Medioambientales Tecmed v. United Mexican States,1,1,0,0,0,ESP,,0,n.a.,n.a.,n.a.,n.a.,ICSID AF,Mexico-Spain BIT,Waste management,SER,US$52m plus interest,52,yes,"US$5533017.12, plus compound interest (at annual rate of 6%, commencing 25 November 1998 until payment). Each party to pay their legal costs and costs of arbitration split.",5.5,no,n.a.,n.a.,n.a.
