pending,ESP,2015,NA,PP,4.6,0,NA,pending,NA,NA,,NA,NA,,,ARB/15/16,BayWa r.e. Renewable Energy GmbH and BayWa r.e. Asset Holding GmbH v. Kingdom of Spain,NA,n.a.,NA,NA,NA,DEU,n.a.,NA,n.a.,n.a.,n.a.,n.a.,ICSID,Energy Charter Treaty,Electric power concession (solar),UTL,unknown,unknown,no,n.a.,n.a.,n.a.,n.a.,n.a.,n.a.
pending,ESP,2015,NA,PP,4.6,0,NA,pending,NA,NA,,NA,NA,,,ARB/15/27,JGC Corporation v. Kingdom of Spain,NA,n.a.,NA,NA,NA,JPN,n.a.,NA,n.a.,n.a.,n.a.,n.a.,ICSID,Energy Charter Treaty,Electric power concession (solar),UTL,unknown,unknown,no,n.a.,n.a.,n.a.,n.a.,n.a.,n.a.
pending,ESP,2015,NA,PP,4.6,0,NA,pending,NA,NA,,NA,NA,,,ARB/15/34,"Cavalum SGPS, S.A. v. Kingdom of Spain",NA,n.a.,NA,NA,NA,PRT,n.a.,NA,n.a.,n.a.,n.a.,n.a.,ICSID,Energy Charter Treaty,Electric power concession (solar),UTL,unknown,unknown,no,n.a.,n.a.,n.a.,n.a.,n.a.,n.a.
pending,ESP,2015,NA,PP,4.6,0,NA,pending,NA,NA,,NA,NA,,,ARB/15/20,Cube Infrastructure Fund SICAV and others v. Kingdom of Spain,NA,n.a.,NA,NA,NA,FRA,n.a.,NA,LUX,n.a.,n.a.,n.a.,ICSID,Energy Charter Treaty,Electric power concession (solar),UTL,unknown,unknown,no,n.a.,n.a.,n.a.,n.a.,n.a.,n.a.
pending,ESP,2015,NA,PP,4.6,0,NA,pending,NA,NA,,NA,NA,,,ARB/15/35,"E.ON SE, E.ON Finanzanlagen GmbH and E.ON Iberia Holding GmbH v. Kingdom of Spain",NA,n.a.,NA,NA,NA,DEU,n.a.,NA,n.a.,n.a.,n.a.,n.a.,ICSID,Energy Charter Treaty,"Electric power concession (solar,wind,mini-hydro)",UTL,unknown,unknown,no,n.a.,n.a.,n.a.,n.a.,n.a.,n.a.
pending,ESP,2015,NA,PP,4.6,0,NA,pending,NA,NA,,NA,NA,,,ARB/15/42,Hydro Energy 1 S.a r.l. and Hydroxana Sweden AB v. Kingdom of Spain,NA,n.a.,NA,NA,NA,LUX,n.a.,NA,SWE,n.a.,n.a.,n.a.,ICSID,Energy Charter Treaty,Electric power consession (solar),UTL,unknown,unknown,no,n.a.,n.a.,n.a.,n.a.,n.a.,n.a.
pending,ESP,2015,NA,PP,4.6,0,NA,pending,NA,NA,,NA,NA,,,ARB/15/23,Mathias Kruck and others v. Kingdom of Spain,NA,n.a.,NA,NA,NA,DEU,n.a.,NA,n.a.,n.a.,n.a.,n.a.,ICSID,Energy Charter Treaty,Electric power concession (solar),UTL,unknown,unknown,no,n.a.,n.a.,n.a.,n.a.,n.a.,n.a.
pending,ESP,2015,NA,PP,4.6,0,NA,pending,NA,NA,,NA,NA,,,ARB/15/25,KS Invest GmbH and TLS Invest GmbH v. Kingdom of Spain,NA,n.a.,NA,NA,NA,DEU,n.a.,NA,n.a.,n.a.,n.a.,n.a.,ICSID,Energy Charter Treaty,Electric power concession (solar),UTL,unknown,unknown,no,n.a.,n.a.,n.a.,n.a.,n.a.,n.a.
pending,ESP,2015,NA,PP,4.6,0,NA,pending,NA,NA,,NA,NA,,,ARB/15/45,"Landesbank Baden-Wurttemberg, HSH Nordbank AG, Landesbank Hessen-Th?_ringen Girozentrale and Norddeutsche Landesbank-Girozentrale v. Kingdom of Spain",NA,n.a.,NA,NA,NA,DEU,n.a.,NA,n.a.,n.a.,n.a.,n.a.,ICSID,Energy Charter Treaty,Electric power concession (solar),UTL,unknown,unknown,no,n.a.,n.a.,n.a.,n.a.,n.a.,n.a.
pending,ESP,2015,NA,PP,4.6,0,NA,pending,NA,NA,,NA,NA,,,ARB/15/36,OperaFund Eco-Invest SICAV PLC and Schwab Holding AG v. Kingdom of Spain,NA,n.a.,NA,NA,NA,MLT,n.a.,NA,CHE,n.a.,n.a.,n.a.,ICSID,Energy Charter Treaty,Electric power concession,UTL,unknown,unknown,no,n.a.,n.a.,n.a.,n.a.,n.a.,n.a.
pending,ESP,2015,NA,PP,4.6,0,NA,pending,NA,NA,,NA,NA,,,ARB/15/38,SolEs Badajoz GmbH v. Kingdom of Spain,NA,n.a.,NA,NA,NA,DEU,n.a.,NA,n.a.,n.a.,n.a.,n.a.,ICSID,Energy Charter Treaty,Electric power concession (solar),UTL,unknown,unknown,no,n.a.,n.a.,n.a.,n.a.,n.a.,n.a.
pending,ESP,2015,NA,PP,4.6,0,NA,pending,NA,NA,,NA,NA,,,ARB/15/4,STEAG GmbH v. Kingdom of Spain,NA,n.a.,NA,NA,NA,DEU,n.a.,NA,n.a.,n.a.,n.a.,n.a.,ICSID,Energy Charter Treaty,Electric power concession,UTL,unknown,unknown,no,n.a.,n.a.,n.a.,n.a.,n.a.,n.a.
pending,ESP,2015,NA,PP,4.6,0,NA,pending,NA,NA,,NA,NA,,,ARB/15/1,Stadtwerke Munchen GmbH and others v. Kingdom of Spain,NA,n.a.,NA,NA,NA,DEU,n.a.,NA,n.a.,n.a.,n.a.,n.a.,ICSID,Energy Charter Treaty,Electric power concession (solar),UTL,unknown,unknown,no,n.a.,n.a.,n.a.,n.a.,n.a.,n.a.
pending,ESP,2015,NA,PP,4.6,0,NA,pending,NA,NA,,NA,NA,,,ARB/15/15,9REN Holding S.a.r.l v. Kingdom of Spain,NA,n.a.,NA,NA,NA,LUX,n.a.,NA,n.a.,n.a.,n.a.,n.a.,ICSID,Energy Charter Treaty,Electric power concession (solar),UTL,unkown,unknown,no,n.a.,n.a.,n.a.,n.a.,n.a.,n.a.
pending,ESP,2015,NA,PP,4.6,0,NA,pending,NA,NA,,NA,NA,,,ARB/15/44,Watkins Holdings S.a r.l. and others v. Kingdom of Spain,NA,n.a.,NA,NA,NA,LUX,n.a.,NA,NLD,ESP,n.a.,n.a.,ICSID,Energy Charter Treaty,Electric power concession (wind),UTL,unknown,unknown,no,n.a.,n.a.,n.a.,n.a.,n.a.,n.a.
pending,GIN,2011,NA,RPG,5,0,NA,pending,NA,NA,,NA,NA,,,ARB/11/29,Getma International and others v. Republic of Guinea,NA,n.a.,NA,NA,NA,FRA,n.a.,NA,n.a.,n.a.,n.a.,n.a.,ICSID,Guinea Investment Law (1987),Port terminal concession,SER,unknown,unknown,no,n.a.,n.a.,n.a.,n.a.,n.a.,n.a.
pending,GIN,2012,NA,RPG,5,0,NA,pending,NA,NA,,NA,NA,,,ARB/12/36,Societe Civile Immobili??re de Gaeta v. Republic of Guinea,NA,n.a.,NA,NA,NA,FRA,n.a.,NA,n.a.,n.a.,n.a.,n.a.,ICSID,Guinea Investment Law (1987),Real estate (commercial),RE,unknown,unknown,no,n.a.,n.a.,n.a.,n.a.,n.a.,n.a.
pending,GIN,2014,NA,RPG,5,0,NA,pending,NA,NA,,NA,NA,,,ARB/14/22,BSG Resources Limited v. Republic of Guinea,NA,n.a.,NA,NA,NA,ISR,n.a.,NA,n.a.,n.a.,n.a.,n.a.,ICSID,"Guinea Investment Law (1995, 1987)",Mining,MIN,unknown,unknown,no,n.a.,n.a.,n.a.,n.a.,n.a.,n.a.
pending,GMB,2014,NA,APRC,3.467,0,NA,pending,NA,NA,3.5 (2015),NA,NA,,,ARB/14/7,African Petroleum Gambia Limited (Block A4) v. Republic of The Gambia,NA,n.a.,NA,NA,NA,GBR,n.a.,NA,n.a.,n.a.,n.a.,n.a.,ICSID,Contract with host state,Oil and gas,OIL,unknown,unknown,no,n.a.,n.a.,n.a.,n.a.,n.a.,n.a.
pending,GMB,2014,NA,APRC,3.467,0,NA,pending,NA,NA,,NA,NA,,,ARB/14/6,African Petroleum Gambia Limited (Block A1) v. Republic of The Gambia,NA,n.a.,NA,NA,NA,GBR,n.a.,NA,n.a.,n.a.,n.a.,n.a.,ICSID,Contract with host state,Oil and gas,OIL,unknown,unknown,no,n.a.,n.a.,n.a.,n.a.,n.a.,n.a.
pending,GNQ,2012,NA,PDGE,5.333,0,NA,pending,NA,NA,,NA,NA,,,CONC(AF)/12/1,"Hess Equatorial Guinea, Inc. y Tullow Equatorial Guinea Limited v. Republic of Equatorial Guinea",NA,n.a.,NA,NA,NA,ESP,n.a.,NA,n.a.,n.a.,n.a.,n.a.,ICSID CR,Equatorial Guinea-Spain BIT,Oil and gas,OIL,US$580m,580,no,n.a.,n.a.,no,n.a.,n.a.,n.a.
pending,GRC,2013,NA,ND,4.25,0,NA,pending,NA,NA,,0,NA,,,ARB/13/8,"Posstova banka, a.s. and ISTROKAPITAL SE v. Greece",1,n.a.,NA,NA,NA,CYP,n.a.,NA,SVK,n.a.,n.a.,n.a.,ICSID,"Cyprus-Greece BIT, Slovakia-Greece BIT",Finance (debt instruments),FIN,unknown,unknown,no,n.a.,n.a.,n.a.,n.a.,n.a.,n.a.
pending,GRC,2014,NA,ND,4.25,0,NA,pending,NA,NA,,0,NA,,,ARB/14/16,Cyprus Popular Bank Public Co. Ltd. V. Hellenic Republic,1,n.a.,NA,NA,NA,CYP,n.a.,NA,n.a.,n.a.,n.a.,n.a.,ICSID,Greece-Cyprus BIT,Finance (debt instruments),FIN,unknown,unknown,no,n.a.,n.a.,n.a.,n.a.,n.a.,n.a.
pending,HUN,2012,NA,FiDeSz-MPSz,3.6425,0,NA,pending,NA,NA,,0,NA,,,ARB/12/9,Dan Cake (Portugal) S.A. v. Hungary,1,n.a.,NA,NA,NA,PRT,n.a.,NA,n.a.,n.a.,n.a.,n.a.,ICSID,Hungary-Portugal BIT,Bakery,MFG,EUR47.9m,54.5,no,n.a.,n.a.,n.a.,n.a.,n.a.,n.a.
pending,HUN,2013,NA,FiDeSz-MPSz,3.678,0,NA,pending,NA,NA,,NA,NA,,,ARB/13/35,Le Che??que Dejeuner and C.D Holding Internationale v. Hungary,NA,n.a.,NA,NA,NA,FRA,n.a.,NA,n.a.,n.a.,n.a.,n.a.,ICSID,France-Hungary BIT,Retail (restaurants),SER,unknown,unknown,no,n.a.,n.a.,n.a.,n.a.,n.a.,n.a.
pending,HUN,2013,NA,FiDeSz-MPSz,3.678,0,NA,pending,NA,NA,,NA,NA,,,ARB/13/21,Edenred S.A. v. Hungary,NA,n.a.,NA,NA,NA,FRA,n.a.,NA,n.a.,n.a.,n.a.,n.a.,ICSID,France-Hungary BIT,Retail (restaurants),SER,unknown,unknown,no,n.a.,n.a.,n.a.,n.a.,n.a.,n.a.
pending,HUN,2014,NA,FiDeSz-MPSz,3.714,0,NA,pending,NA,NA,,NA,NA,,,ARB/14/20,Sodexo Pass International SAS v. Hungary,NA,n.a.,NA,NA,NA,FRA,n.a.,NA,n.a.,n.a.,n.a.,n.a.,ICSID,France-Hungary BIT,Retail (restaurants),SER,unknown,unknown,no,n.a.,n.a.,n.a.,n.a.,n.a.,n.a.
pending,IDN,2012,NA,PD,3.167,0,NA,pending,NA,NA,,0,NA,,,ARB/12/14 and 12/40),"Churchill Mining and Planet Mining Pty Ltd, formerly ARB/12/14 v. Republic of Indonesia",1,n.a.,NA,NA,NA,GBR,n.a.,NA,n.a.,n.a.,n.a.,n.a.,ICSID,"Indonesia-UK BIT, Austria-Indonesia BIT",Mining,MIN,unknown,unknown,no,n.a.,n.a.,n.a.,n.a.,n.a.,n.a.
pending,IND,2012,NA,PD,3.167,0,NA,pending,NA,NA,,0,NA,,,9/1/2013,"CC/Devas (Mauritius) Ltd., Devas Employees Mauritius Private Limited, and Telcom Devas Mauritius Limited v. Republic of India",1,n.a.,NA,NA,NA,MUS,n.a.,NA,n.a.,n.a.,n.a.,n.a.,PCA,India-Mauritius BIT,Telecommunication (Satellite),TEL,US$1000m,1000,no,n.a.,n.a.,n.a.,n.a.,n.a.,n.a.
pending,IND,2013,NA,PD,3.167,0,NA,pending,NA,NA,,NA,NA,,,n.a.,Deutsche Telekom AG v. India,NA,n.a.,NA,NA,NA,DEU,n.a.,NA,n.a.,n.a.,n.a.,n.a.,UNCITRAL,Germany-India BIT,Telecommunications,TEL,unknown,unknown,no,n.a.,n.a.,n.a.,n.a.,n.a.,n.a.
pending,IND,2013,NA,PD,3.167,0,NA,pending,NA,NA,,NA,NA,,,n.a.,Khaitan Holdings (Mauritius) Limited v. India,NA,n.a.,NA,NA,NA,MUS,n.a.,NA,n.a.,n.a.,n.a.,n.a.,UNCITRAL,Mauritius-India BIT,Telecommunications (mobile),TEL,unknown,unknown,no,n.a.,n.a.,n.a.,n.a.,n.a.,n.a.
pending,IND,2014,NA,PD,3.167,0,NA,pending,NA,NA,,NA,NA,,,n.a.,Vodafone v. India,NA,n.a.,NA,NA,NA,NLD,n.a.,NA,n.a.,n.a.,n.a.,n.a.,UNCITRAL,Netherlands-India BIT,Telecommunications,TEL,unknown,unknown,no,n.a.,n.a.,n.a.,n.a.,n.a.,n.a.
pending,KEN,2015,NA,TNA,4,0,NA,pending,NA,NA,,NA,NA,,,ARB/15/29,"Cortec Mining Kenya Limited, Cortec (Pty) Limited and Stirling Capital Limited v. Republic of Kenya",NA,n.a.,NA,NA,NA,GBR,n.a.,NA,n.a.,n.a.,n.a.,n.a.,ICSID,Kenya-United Kingdon BIT,Mining (rare earths),MIN,US$2000000000,2000,no,n.a.,n.a.,n.a.,n.a.,n.a.,n.a.
pending,KOR,2012,NA,GNP,5,0,0,pending,NA,NA,LKP; 5 (2016),NA,4.791,,,ARB/12/37,LSF-KEB Holdings SCA and others v. Republic of Korea,NA,n.a.,NA,NA,NA,BELLUX,n.a.,NA,n.a.,n.a.,n.a.,n.a.,ICSID,Belgium & Luxembourg-Korea BIT,Banking,FIN,unknown,unknown,no,n.a.,n.a.,n.a.,n.a.,n.a.,n.a.
pending,KOR,2015,NA,NFP,5,0,NA,pending,NA,NA,LKP; 5 (2016),NA,NA,,,ARB/15/17,Hanocal Holding B.V. and IPIC International B.V. v. Republic of Korea,NA,n.a.,NA,NA,NA,NLD,n.a.,NA,n.a.,n.a.,n.a.,n.a.,ICSID,Republic of Korea-Netherlands BIT,Oil and gas,OIL,US$168m,168,no,n.a.,n.a.,n.a.,n.a.,n.a.,n.a.
pending,KOR,2015,NA,NFP,5,0,NA,pending,NA,NA,LKP; 5 (2016),NA,NA,,,n.a.,Mohammad Reza Dayyani and others v. Republic of Korea,NA,n.a.,NA,NA,NA,IRN,n.a.,NA,n.a.,n.a.,n.a.,n.a.,UNCITRAL,Islamic Republic of Iran-Republic of Korea BIT,Manufacturing (electronics),MFG,unknown,unknown,no,n.a.,n.a.,n.a.,n.a.,n.a.,n.a.
pending,LVA,2012,NA,Unity,4,0,NA,pending,NA,NA,V,0,NA,,,ARB/12/33,UAB E energija (Lithuania) v. Republic of Latvia,1,n.a.,NA,NA,NA,LTU,n.a.,NA,n.a.,n.a.,n.a.,n.a.,ICSID,Latvia-Lithuania BIT,Electric power concession,UTL,EUR7m,8.7,no,n.a.,n.a.,n.a.,n.a.,n.a.,n.a.
pending,MDA,2012,NA,PDM,3.166,0,NA,pending,NA,NA,,0,NA,,,V2012/175,Energoalians SARL v. Republic of Moldova,1,n.a.,NA,NA,NA,UKR,n.a.,NA,n.a.,n.a.,n.a.,n.a.,SCC,"Moldova-Ukraine BIT, Energy Charter Treaty",Electric power concession,UTL,US$1.7m,1.7,no,n.a.,n.a.,n.a.,n.a.,n.a.,n.a.
pending,MEX,2015,NA,PRI,4,0,NA,pending,NA,NA,,0,NA,,,ARB(AF)/15/2,Lion Mexico Consolidated L.P. v. United Mexican States,1,n.a.,NA,NA,NA,CAN,n.a.,NA,n.a.,n.a.,n.a.,n.a.,ICSID AF,NAFTA,Construction,UTL,US$200m,200,no,n.a.,n.a.,n.a.,n.a.,n.a.,n.a.
pending,MEX,2013,NA,PRI,4,0,NA,pending,NA,NA,,NA,NA,,,n.a.,Degremont v. United Mexican States,NA,n.a.,NA,NA,NA,FRA,n.a.,NA,n.a.,n.a.,n.a.,n.a.,unknown,Mexico-France BIT,Wastewater treatment services,SER,unknown,unknown,no,n.a.,n.a.,n.a.,n.a.,n.a.,n.a.
pending,MEX,2013,NA,PRI,4,0,NA,pending,NA,NA,,NA,NA,,,n.a.,Livsmart Holdings v. United Mexican States,NA,n.a.,NA,NA,NA,PAN,n.a.,NA,n.a.,n.a.,n.a.,n.a.,unknown,Mexico-Panama BIT,Import (beverages),SER,US$15m,15,no,n.a.,n.a.,n.a.,n.a.,n.a.,n.a.
pending,MEX,2013,NA,PRI,4,0,NA,pending,NA,NA,,NA,NA,,,n.a.,KBR Inc. v. United Mexican States,NA,n.a.,NA,NA,NA,USA,n.a.,NA,n.a.,n.a.,n.a.,n.a.,ICC,NAFTA,Oil and gas,OIL,US$400m,400,no,n.a.,n.a.,n.a.,n.a.,n.a.,n.a.
pending,MEX,2014,NA,PRI,4,0,NA,pending,NA,NA,,NA,NA,,,n.a.,"FCC Construccion, S.A. v. United Mexican States",NA,n.a.,NA,NA,NA,ESP,n.a.,NA,n.a.,n.a.,n.a.,n.a.,unknown,Mexico-Spain BIT,"Tunnel (build, operate)",UTL,MXN1299m,100.4,no,n.a.,n.a.,n.a.,n.a.,n.a.,n.a.
pending,MEX,2014,NA,PRI,4,0,NA,pending,NA,NA,,NA,NA,,,n.a.,B-Mex LLC et al v. United Mexican States,NA,n.a.,NA,NA,NA,USA,n.a.,NA,n.a.,n.a.,n.a.,n.a.,UNCITRAL,NAFTA,Gaming,SER,US$100m,100,no,n.a.,n.a.,n.a.,n.a.,n.a.,n.a.
pending,MEX,2015,NA,PRI,4,0,NA,pending,NA,NA,,NA,NA,,,n.a.,"Shanara Maritime International, S.A. and Marfield Ltd. Inc. v. United Mexican States",NA,n.a.,NA,NA,NA,PAN,n.a.,NA,n.a.,n.a.,n.a.,n.a.,n.a.,Mexico-Panama BIT,Transportation (maritime),UTL,US$408m,408,no,n.a.,n.a.,n.a.,n.a.,n.a.,n.a.
pending,MEX,2012,NA,PAN,4.636,0,NA,pending,NA,NA,,0,NA,,,ARB(AF)/12/4,Telefonica S.A. v. United Mexican States,1,n.a.,NA,NA,NA,ESP,n.a.,NA,n.a.,n.a.,n.a.,n.a.,ICSID AF,Mexico-Spain BIT,Telecommunications (mobile),TEL,More than US$1b,1000,no,n.a.,n.a.,n.a.,n.a.,n.a.,n.a.
pending,MRT,2014,NA,UPR,5,0,NA,pending,NA,NA,,NA,NA,,,ARB/14/23,Tamagot Bumi S.A. and Bumi Mauritania S.A. v. Islamic Republic of Mauritania,NA,n.a.,NA,NA,NA,unknown,n.a.,NA,n.a.,n.a.,n.a.,n.a.,ICSID,"Contract, Mauritania Investment Law",Mining (iron ore),MIN,unknown,unknown,no,n.a.,n.a.,n.a.,n.a.,n.a.,n.a.
pending,PAN,2013,NA,AC,4,0,NA,pending,NA,NA,CD,0,NA,,,ARB/13/28,"Transglobal Green Energy LLC and Transglobal Green Panama, S.A. v. Panama",1,n.a.,NA,NA,NA,USA,n.a.,NA,n.a.,n.a.,n.a.,n.a.,ICSID,Panama-United States BIT,Electric power and hydrocarbon concession,UTL,US$2500m,2500,no,n.a.,n.a.,n.a.,n.a.,n.a.,n.a.
pending,PAN,2014,NA,AC,4,0,NA,pending,NA,NA,,NA,NA,,,ARB/14/33,"IBT Group LLC., Constructor, Consulting and Engineering (Panama), S.A., and International Business and Trade, LLC. V. Republic of Panama",NA,n.a.,NA,NA,NA,USA,n.a.,NA,n.a.,n.a.,n.a.,n.a.,ICSID,Panama-United States BIT,Manufacturing (asphalt),MFG,unknown,unknown,no,n.a.,n.a.,n.a.,n.a.,n.a.,n.a.
pending,PAN,2015,NA,PP,4,0,NA,pending,NA,NA,PAP,NA,NA,,,ARB/15/14,Alvarez y Marin Corporation S.A and others v. Republic of Panama,NA,n.a.,NA,NA,NA,CRI,n.a.,NA,NLD,n.a.,n.a.,n.a.,ICSID,"Netherlands Panama BIT, Central America Panama FTA",Tourism,SER,unknown,unknown,no,n.a.,n.a.,n.a.,n.a.,n.a.,n.a.
pending,PER,2011,NA,PAP,4.667,0,NA,pending,NA,NA,,0,NA,,,UNCT/13/1,"Renco Group, Inc v. Peru",1,n.a.,NA,NA,NA,USA,n.a.,NA,n.a.,n.a.,n.a.,n.a.,ICSID UNCITRAL,Peru-United States Trade Promotion Agreement,Mining,MIN,US$800m,800,no,n.a.,n.a.,no,n.a.,n.a.,n.a.
pending,PER,2011,NA,PAP,4.667,0,NA,pending,NA,NA,,NA,NA,,,ARB/11/21,"DP World Callao S.R.L., P&O Dover (Holding) Limited, and The Peninsular and Oriental Steam Navigation Company v. Republic of Peru",NA,n.a.,NA,NA,NA,GBR,n.a.,NA,n.a.,n.a.,n.a.,n.a.,ICSID,"Peru-United Kingdom BIT, Contract",Port terminal concession,SER,US$200m,200,no,n.a.,n.a.,n.a.,n.a.,n.a.,n.a.
pending,PHL,2011,NA,LP,4,0,NA,pending,NA,NA,,NA,NA,,,ARB/11/27,Baggerwerken Decloedt En Zoon NV v. Republic of the Philippines,NA,n.a.,NA,NA,NA,BELLUX,n.a.,NA,n.a.,n.a.,n.a.,n.a.,ICSID,Belgium & Luxembourg-Philippines BIT,Dredging operations,SER,Philippines Peso 6b,134.01,no,n.a.,n.a.,n.a.,n.a.,n.a.,n.a.
pending,RUS,2015,NA,United Russia,3.033,0,NA,pending,NA,NA,,NA,NA,,,7/1/2015,Aeroport Belbek LLC and Mr Igor Valerievich Kolomoisky v. Russia,NA,n.a.,NA,NA,NA,UKR,n.a.,NA,n.a.,n.a.,n.a.,n.a.,UNCITRAL PCA,Russian-Ukraine BIT,Transportation (air),UTL,US$15m,15,no,n.a.,n.a.,n.a.,n.a.,n.a.,n.a.
pending,RUS,2015,NA,United Russia,3.033,0,NA,pending,NA,NA,,NA,NA,,,AA577,Everest Estate LLC et al v. The Russian Federation,NA,n.a.,NA,NA,NA,UKR,n.a.,NA,n.a.,n.a.,n.a.,n.a.,PCA,Russian-Ukraine BIT,Real Estate (private),RE,unknown,unknown,no,n.a.,n.a.,n.a.,n.a.,n.a.,n.a.
pending,RUS,2015,NA,United Russia,3.033,0,NA,pending,NA,NA,,NA,NA,,,2015-29,Limited Liability Company Lugzor and others v. The Russian Federation,NA,n.a.,NA,NA,NA,UKR,n.a.,NA,n.a.,n.a.,n.a.,n.a.,PCA,Russian-Ukraine BIT,Real Estate,RE,unknown,unknown,no,n.a.,n.a.,n.a.,n.a.,n.a.,n.a.
pending,RUS,2015,NA,United Russia,3.033,0,NA,pending,NA,NA,,NA,NA,,,AA568,Privatbank and Finance Company Finilion LLC v. The Russian Federation,NA,n.a.,NA,NA,NA,UKR,n.a.,NA,n.a.,n.a.,n.a.,n.a.,PCA,Russian-Ukraine BIT,Banking (finance and services),FIN,unknown,unknown,no,n.a.,n.a.,n.a.,n.a.,n.a.,n.a.
pending,RUS,2015,NA,United Russia,3.033,0,NA,pending,NA,NA,,NA,NA,,,2015-35,Stabil LLC and others v. The Russian Federation,NA,n.a.,NA,NA,NA,UKR,n.a.,NA,n.a.,n.a.,n.a.,n.a.,PCA,Russian-Ukraine BIT,Services (petorl station),SER,unknown,unknown,no,n.a.,n.a.,n.a.,n.a.,n.a.,n.a.
pending,RUS,2015,NA,United Russia,3.033,0,NA,pending,NA,NA,,NA,NA,,,2015-34,PJSC Ukrnafta v. The Russian Federation,NA,n.a.,NA,NA,NA,UKR,n.a.,NA,n.a.,n.a.,n.a.,n.a.,PCA,Russian-Ukraine BIT,Services (petorl station),SER,unknown,unknown,no,n.a.,n.a.,n.a.,n.a.,n.a.,n.a.
pending,SDN,2014,NA,NC,3.5,0,NA,pending,NA,NA,NCP,0,NA,,,ARB/14/2,Michael Dagher v. Republic of the Sudan,1,n.a.,NA,NA,NA,JOR,n.a.,NA,LBN,n.a.,n.a.,n.a.,ICSID,"Sudan-Jordan BIT, Sudan-Lebanon BIT",Telecommunications (wireless internet),TEL,unknown,unknown,no,n.a.,n.a.,n.a.,n.a.,n.a.,n.a.
pending,SLV,2009,NA,ARENA,5,0,NA,pending,NA,NA,,0,NA,,,ARB/09/12,Pac Rim Cayman LLC v. Republic of El Salvador,1,n.a.,NA,NA,NA,USA,n.a.,NA,n.a.,n.a.,n.a.,n.a.,ICSID,"CAFTA-DR, El Salvador Investment Law (1999)",Mining (gold and silver),MIN,"US$75m plus uncalculated losses (estimated at no less than an additional $75m), plus interest and legal costs",75,no,n.a.,n.a.,n.a.,n.a.,n.a.,n.a.
pending,SLV,2013,NA,FMLN,5,0,NA,pending,NA,NA,,NA,NA,,,ARB/13/18,Enel Green Power S.p.A. v. Republic of El Salvador,NA,n.a.,NA,NA,NA,ITA,n.a.,NA,n.a.,n.a.,n.a.,n.a.,ICSID,El Salvador Investment Law (1999),Electric power concession (thermal),UTL,unknown,unknown,no,n.a.,n.a.,n.a.,n.a.,n.a.,n.a.
pending,SVN,2005,NA,SDS,4.75,0,NA,pending,NA,NA,,0,NA,,,ARB/05/24,Hrvatska Elektropriveda d.d. (HEP) v. Republic of Slovenia,1,n.a.,NA,NA,NA,HRV,n.a.,NA,n.a.,n.a.,n.a.,n.a.,ICSID,Energy Charter Treaty,Electric power concession (nuclear),UTL,?_31.7m,35,no,n.a.,n.a.,n.a.,n.a.,n.a.,n.a.
pending,SVN,2013,NA,SDS,5.167,0,NA,pending,NA,NA,,NA,NA,,,ARB/13/10,"Impresa Grassetto S. p. A., in liquidation v. Republic of Slovenia",NA,n.a.,NA,NA,NA,ITA,n.a.,NA,n.a.,n.a.,n.a.,n.a.,ICSID,Italy-Slovenia BIT,Highway construction project,UTL,unknown,unknown,no,n.a.,n.a.,n.a.,n.a.,n.a.,n.a.
pending,TUN,2004,NA,RCD,3.5,0,NA,pending,NA,NA,,NA,NA,,,ARB/04/12,ABCI Investments NV v. Republic of Tunisia,NA,n.a.,NA,NA,NA,NLD,n.a.,NA,n.a.,n.a.,n.a.,n.a.,ICSID,"Netherlands-Tunisia BIT, Tunisia Investment Law (1969)",Banking,FIN,unknown,unknown,no,n.a.,n.a.,n.a.,n.a.,n.a.,n.a.
pending,TUR,2014,NA,AKP,4.7,0,NA,pending,NA,NA,,NA,NA,,,ARB/14/35,Baymina Enerji Anonim Sirketi v. Boru Hatlari ile Petrol Tasima Anonim Sirketi,NA,n.a.,NA,NA,NA,unknown,n.a.,NA,n.a.,n.a.,n.a.,n.a.,ICSID,Contract with host state,Electric power concession (natural gas),UTL,unknown,unknown,no,n.a.,n.a.,n.a.,n.a.,n.a.,n.a.
pending,TUR,2015,NA,AKP,4.8,0,NA,pending,NA,NA,,NA,NA,,,ARB/15/8,Aktau Petrol Ticaret A.S. and Som Petrol Ticaret A.S. v. Republic of Kazakhstan,NA,n.a.,NA,NA,NA,KAZ,n.a.,NA,n.a.,n.a.,n.a.,n.a.,ICSID,Kazakhstan Turkey BIT,Transportation,UTL,US$150,150,no,n.a.,n.a.,n.a.,n.a.,n.a.,n.a.
pending,UGA,2012,NA,NRM,4,0,NA,pending,NA,NA,,NA,NA,,,ARB/12/34,Tullow Uganda Operations PTY LTD v. Republic of Uganda,NA,n.a.,NA,NA,NA,GBR,n.a.,NA,n.a.,n.a.,n.a.,n.a.,ICSID,Contract with host state,Oil and gas,OIL,unknown,unknown,no,n.a.,n.a.,n.a.,n.a.,n.a.,n.a.
pending,UGA,2015,NA,NRM,4,0,NA,pending,NA,NA,,NA,NA,,,ARB/15/11,Total E&P Uganda BV v. Republic of Uganda,NA,n.a.,NA,NA,NA,NLD,n.a.,NA,n.a.,n.a.,n.a.,n.a.,ICSID,Netherlands-Uganda BIT,Oil and gas (mining),OIL,unknown,unknown,no,n.a.,n.a.,n.a.,n.a.,n.a.,n.a.
pending,USA,2007,NA,Republicans,5,0,NA,pending,NA,NA,,NA,NA,,,n.a.,Domtar Inc. v. United States of America,NA,n.a.,NA,NA,NA,CAN,n.a.,NA,n.a.,n.a.,n.a.,n.a.,UNCITRAL,NAFTA,Manufacturing (paper),MFG,US$200m,200,no,n.a.,n.a.,n.a.,n.a.,n.a.,n.a.
pending,VNM,2013,NA,CPV,3.5,0,NA,pending,NA,NA,,NA,NA,,,n.a.,RECOFI v. Vietnam,NA,n.a.,NA,NA,NA,FRA,n.a.,0,n.a.,n.a.,n.a.,n.a.,UNCITRAL,France-Vietnam BIT,Food assistance program,AGR,unknown,unknown,no,n.a.,n.a.,n.a.,n.a.,n.a.,n.a.
pending,YEM,2014,NA,GPC,3.429,0,NA,pending,NA,NA,,NA,NA,,,ARB/14/30,Beijing Urban Construction Group Co. Ltd. V. Republic of Yemen,NA,n.a.,NA,NA,NA,CHN,n.a.,0,n.a.,n.a.,n.a.,n.a.,ICSID,China-Yemen BIT,Airport,SER,unknown,unknown,no,n.a.,n.a.,n.a.,n.a.,n.a.,n.a.
pending,ALB,2014,NA,PSS,2.5,1,NA,pending,NA,NA,,NA,NA,,,ARB/14/26,"Albaniabeg Ambient Sh.p.k, M. Angelo Novelli and Costruzioni S.r.l. v. Republic of Albania",NA,n.a.,NA,NA,NA,ITA,n.a.,0,n.a.,n.a.,n.a.,n.a.,ICSID,Energy Charter Treaty,Waste management,SER,unknown,unknown,no,n.a.,n.a.,n.a.,n.a.,n.a.,n.a.
pending,ALB,2015,NA,PSS,2.5,1,NA,pending,NA,NA,,NA,NA,,,ARB/15/28,Hydro S.r.l. and others v. Republic of Albania,NA,n.a.,NA,NA,NA,ITA,n.a.,0,n.a.,n.a.,n.a.,n.a.,ICSID,Albania-Italy BIT,Electric power consession (hydropower and other renewables),UTL,unknown,unknown,no,n.a.,n.a.,n.a.,n.a.,n.a.,n.a.
pending,ARG,2007,NA,FPV,1.727,1,NA,pending,NA,NA,,0,NA,,,ARB/07/31,HOCHTIEF Aktiengesellschaft v. Argentine Republic,1,n.a.,NA,NA,NA,DEU,n.a.,NA,n.a.,n.a.,n.a.,n.a.,ICSID,Argentina-Germany BIT,Highway construction project,UTL,unknown,unknown,no,n.a.,n.a.,n.a.,n.a.,n.a.,n.a.
pending,ARG,2007,NA,FPV,1.727,1,NA,pending,NA,NA,,0,NA,,,ARB/07/26,"Urbaser S.A. & Consorcio de Aguas Bilbao Biskaia, Bilbao Biskaia Ur Partzuergoa v. Argentine Republic",1,n.a.,NA,NA,NA,ESP,n.a.,NA,n.a.,n.a.,n.a.,n.a.,ICSID,Argentina-Spain BIT,Water services concession,UTL,unknown,unknown,no,n.a.,n.a.,n.a.,n.a.,n.a.,n.a.
pending,ARG,2007,NA,FPV,1.727,1,NA,pending,NA,NA,,NA,NA,,,ARB/07/5,Abaclat and Others v. Argentine Republic (formerly Giovanna A. Beccara and others v. Argentine Republic ),NA,n.a.,NA,NA,NA,ITA,n.a.,NA,n.a.,n.a.,n.a.,n.a.,ICSID,Argentina-Italy BIT,Finance (debt instruments),FIN,Approximately US$3.6b,3600,no,n.a.,n.a.,n.a.,n.a.,n.a.,n.a.
pending,ARG,2007,NA,FPV,1.727,1,NA,pending,NA,NA,,NA,NA,,,ARB/07/8,"Giovanni Alemanni, et al v. Argentine Republic",NA,n.a.,NA,NA,NA,ITA,n.a.,NA,n.a.,n.a.,n.a.,n.a.,ICSID,Argentina-Italy BIT,Finance (debt instruments),FIN,US$1.2b,1200,no,n.a.,n.a.,n.a.,n.a.,n.a.,n.a.
pending,ARG,2008,NA,FPV,1.727,1,NA,pending,NA,NA,,NA,NA,,,ARB/08/9,"Ambiente Ufficio S.p.A. and others v. Argentine Republic (formerly Giordano Alpi, et al v. Argentine Republic)",NA,n.a.,NA,NA,NA,ITA,n.a.,NA,n.a.,n.a.,n.a.,n.a.,ICSID,Argentina-Italy BIT,Finance (debt instruments),FIN,US$10m,10,no,n.a.,n.a.,n.a.,n.a.,n.a.,n.a.
pending,ARG,2014,NA,FPV,1.727,1,NA,pending,NA,NA,,NA,NA,,,ARB/14/32,Casinos Austria International GmbH and Casinos Austria Aktiengesellschaft v. Argentine Republic,NA,n.a.,NA,NA,NA,AUT,n.a.,NA,n.a.,n.a.,n.a.,n.a.,ICSID,Argentina-Austria BIT,Gaming,SER,unknown,unknown,no,n.a.,n.a.,n.a.,n.a.,n.a.,n.a.
pending,ARG,2015,NA,FPV,1.727,1,NA,pending,NA,NA,,NA,NA,,,ARB/15/48,"Abertis Infraestructuras, S.A. v. Argentine Republic",NA,n.a.,NA,NA,NA,ESP,n.a.,NA,n.a.,n.a.,n.a.,n.a.,ICSID,Argentina-Spain BIT,Transportation (toll roads),UTL,unknown,unknown,no,n.a.,n.a.,n.a.,n.a.,n.a.,n.a.
pending,ARG,2015,NA,FPV,1.727,1,NA,pending,NA,NA,,NA,NA,,,unknown,ICS Inspection and Control Services Limited v. The Argentine Republic (II),NA,n.a.,NA,NA,NA,GBR,n.a.,NA,n.a.,n.a.,n.a.,n.a.,UNCITRAL,Argentina-United Kingdom,Services (government financial consulting),SER,unknown,unknown,no,n.a.,n.a.,n.a.,n.a.,n.a.,n.a.
pending,ARG,2015,NA,FPV,1.727,1,NA,pending,NA,NA,,NA,NA,,,ARB/15/39,Salini Impregilo S.p.A. v. Argentine Republic,NA,n.a.,NA,NA,NA,ITA,n.a.,NA,n.a.,n.a.,n.a.,n.a.,ICSID,Argentina-Italy BIT,Construction (Highways),UTL,unknown,unknown,no,n.a.,n.a.,n.a.,n.a.,n.a.,n.a.
2008,ARG,2002,FPV,PJ,2.409,1,1,pending,NA,NA,,0,1.557,,,ARB/02/17,AES Corporation v. Argentine Republic,1,3,1,1,2,USA,,0,n.a.,n.a.,n.a.,n.a.,ICSID,Argentina-United States BIT,Electric power concession,UTL,US$750m,750,yes,settlement,settlement,n.a.,n.a.,n.a.,n.a.
pending,ARG,2003,NA,PJ,2.545,1,NA,pending,NA,NA,,1,NA,,,ARB/03/19,"Suez, Sociedad General de Aguas de Barcelona, SA & Interagua Servicios Integrales de Agua SA v Argentine Republic",0,n.a.,NA,NA,NA,FRA,n.a.,NA,ESP,n.a.,n.a.,n.a.,ICSID,"Argentina-France BIT, Argentina-Spain BIT",Water services concession,UTL,unknown,unknown,no,n.a.,n.a.,n.a.,n.a.,n.a.,n.a.
pending,ARG,2003,NA,PJ,2.545,1,NA,pending,NA,NA,,1,NA,,,ARB/03/17,"Suez, Sociedad General de Aguas de Barcelona, SA & Interagua Servicios Integrales de Agua SA v. Argentine Republic",0,n.a.,NA,NA,NA,FRA,n.a.,NA,ESP,n.a.,n.a.,n.a.,ICSID,"Argentina-France BIT, Argentina-Spain BIT",Water services concession,UTL,unknown,unknown,no,n.a.,n.a.,n.a.,n.a.,n.a.,n.a.
2007,ARG,2003,FPV,PJ,2.545,1,1,pending,NA,NA,,NA,1.554,,,ARB/03/2,Camuzzi International SA v. Argentine Republic,NA,n.a.,NA,NA,NA,BELLUX,n.a.,0,n.a.,n.a.,n.a.,n.a.,ICSID,Argentina-Belgium & Luxembourg BIT,Oil and gas,OIL,US$337m,337,no,n.a.,n.a.,n.a.,n.a.,n.a.,n.a.
2008,ARG,2003,FPV,PJ,2.545,1,1,pending,NA,NA,,NA,1.557,,,ARB/03/27,Unisys v. Argentine Republic,NA,3,1,1,2,USA,n.a.,0,n.a.,n.a.,n.a.,n.a.,ICSID,Argentina-United States BIT,Software,SER,unknown,unknown,yes,settlement,settlement,n.a.,n.a.,n.a.,n.a.
pending,ARG,2004,NA,PJ,2.545,1,NA,pending,NA,NA,,NA,NA,,,ARB/04/16,Mobil Exploration and Development Inc. Suc. Argentina & Mobil Argentina SA v. Argentine Republic,NA,n.a.,NA,NA,NA,USA,n.a.,NA,n.a.,n.a.,n.a.,n.a.,ICSID,Argentina-United States BIT,Oil and gas (gas production),OIL,In excess of $200m,200,no,n.a.,n.a.,n.a.,n.a.,n.a.,n.a.
pending,AUS,2011,NA,ALP,1.889,1,NA,pending,NA,NA,,0,NA,,,12/1/2012,Philip Morris Asia Limited v. The Commonwealth of Australia,1,n.a.,NA,NA,NA,HKG,n.a.,NA,n.a.,n.a.,n.a.,n.a.,PCA,Australia-Hong Kong BIT,"Manufacturing (cigarettes, tobacco)",MFG,unknown,unknown,no,n.a.,n.a.,n.a.,n.a.,n.a.,n.a.
