2007,LTU,2005,independent,independent,NA,NA,NA,state,0,0,,0,NA,,,ARB/05/8,Parkerings-Compagniet AS v. Republic of Lithuania,1,0,NA,NA,NA,NOR,,0,n.a.,n.a.,n.a.,n.a.,ICSID,Lithuania-Norway BIT,Public parking concession,SER,?_37.1m,40,yes,0,0,no,n.a.,n.a.,n.a.
2013,LTU,2012,independent,independent,NA,NA,NA,state,0,0,,NA,NA,,,n.a.,OAO Gazprom v. The Republic of Lithuania,NA,0,NA,NA,NA,RUS,,0,n.a.,n.a.,n.a.,n.a.,ICC,Lithuania-Russian Federation BIT,Electric power concession,UTL,unknown,unknown,yes,0,0,no,n.a.,n.a.,n.a.
2003,MAR,2000,independent,independent,NA,NA,NA,state,0,0,,0,NA,,,ARB/00/6,Consortium RFCC v. Morocco,1,0,NA,NA,NA,ITA,,0,n.a.,n.a.,n.a.,n.a.,ICSID,Italy-Morocco BIT,Highway construction project,UTL,?_72186174.35,68,yes,0,0,yes,2004,2006,upheld
2003,MMR,2000,independent,independent,NA,NA,NA,state,0,0,,1,NA,,,ARB/01/1,Yaung Chi OO Trading Pte Ltd. v. Government of the Union of Myanmar,0,0,NA,NA,NA,SGP,,0,n.a.,n.a.,n.a.,n.a.,ad hoc,ASEAN Agreement for the Promotion and Protection of Investments (1987),Brewery,MFG,unknown,unknown,yes,0,0,no,n.a.,n.a.,n.a.
2015,OMN,2011,independent,independent,NA,NA,NA,state,0,0,,0,NA,,,ARB/11/33,Adel A Hamadi Al Tamimi v. Sultanate of Oman,1,0,NA,NA,NA,USA,,0,n.a.,n.a.,n.a.,n.a.,ICSID,Oman-United States FTA,Mining (quarrying),MIN,US$560m,560,yes,0,0,no,n.a.,n.a.,n.a.
2009,PAK,2003,PPP,independent,NA,NA,1,state,0,0,,0,2.541,,2.526 (2008),ARB/03/29,Bayindir Insaat Turizm Ticaret Ve Sanayi AS v. Islamic Republic of Pakistan,1,3,1,1,2,TUR,,0,n.a.,n.a.,n.a.,n.a.,ICSID,Pakistan-Turkey BIT,Highway construction project,UTL,In excess of US$300m,300,yes,0,0,no,n.a.,n.a.,n.a.
2009,ROM,2005,independent,independent,NA,NA,NA,state,0,0,,0,NA,,,ARB/05/13,EDF (Services) Limited v. Republic of Romania,1,0,NA,NA,NA,GBR,,0,n.a.,n.a.,n.a.,n.a.,ICSID,Romania-United Kingdom BIT,Duty free concession,SER,unknown,unknown,yes,0,0,no,n.a.,n.a.,n.a.
2011,ROM,2006,independent,independent,NA,NA,NA,state,0,0,,0,NA,,,ARB/06/1,Spyridon Roussalis v. Romania,1,0,NA,NA,NA,GRC,,0,n.a.,n.a.,n.a.,n.a.,ICSID,Greece-Romania BIT,Import/Export (foodstuffs),AGR,Over US$100m,100,yes,0,0,no,n.a.,n.a.,n.a.
2013,ROM,2006,independent,independent,NA,NA,NA,state,0,0,,0,NA,,,ARB/06/3,Rompetrol Group NV v. Romania,1,0,NA,NA,NA,NLD,,0,n.a.,n.a.,n.a.,n.a.,ICSID,Netherlands-Romania BIT,Oil and gas,OIL,At least US$100m,100,yes,0,0,no,n.a.,n.a.,n.a.
2013,ROM,2010,independent,independent,NA,NA,NA,state,0,0,,0,NA,,,ARB/10/22,Omer Dede and Serdar Elhuseyni v. Romania,1,0,NA,NA,NA,TUR,,0,n.a.,n.a.,n.a.,n.a.,ICSID,Romania-Turkey BIT,Manufacturing (machinery),MFG,Approximately ?_2m,2.8,yes,0,0,no,n.a.,n.a.,n.a.
2006,RUS,2004,independent,independent,NA,NA,NA,state,0,0,,0,NA,,,080/2004,Vladimir Berschader and Michael Berschader v. Russian Federation,1,0,NA,NA,NA,BELLUX,,0,n.a.,n.a.,n.a.,n.a.,SCC,Belgium & Luxembourg-USSR BIT,Real estate (court facilities),RE,US$13287147 plus interest,13,yes,0,0,n.a.,n.a.,n.a.,n.a.
2014,TUN,2013,independent,independent,NA,NA,NA,state,0,0,,NA,NA,,,ARB/13/15,Lundin Tunisia B. V. v. Republic of Tunisia,NA,0,NA,NA,NA,NLD,,0,n.a.,n.a.,n.a.,n.a.,ICSID,Contract with host state,Oil and gas (exploration),OIL,unknown,unknown,yes,0,0,no,n.a.,n.a.,n.a.
2012,UKR,2008,PR,independent,NA,NA,0,state,0,0,,0,3.048,,,ARB/08/11,"Bosh International, Inc. and B&P LTD Foreign Investments Enterprise v. Ukraine",1,2,1,NA,1,USA,,0,n.a.,n.a.,n.a.,n.a.,ICSID,Ukraine-United States BIT,Tourism (hotel),SER,unknown,unknown,yes,0,0,no,n.a.,n.a.,n.a.
2011,UKR,2008,PR,independent,NA,NA,0,state,0,0,,0,3.077,,3.048 (2012),ARB/08/16,GEA Group Aktiengesellschaft v. Ukraine,1,2,1,NA,1,DEU,,0,n.a.,n.a.,n.a.,n.a.,ICSID,Germany-Ukraine BIT,Oil and gas,OIL,"Approximately US$30m, plus interest",30,yes,0,0,no,n.a.,n.a.,n.a.
2008,UKR,2005,independent,independent,NA,NA,NA,state,0,0,,0,NA,,,080/2005,AMTO LLC v. Ukraine,1,0,NA,NA,NA,LVA,,0,n.a.,n.a.,n.a.,n.a.,SCC,Energy Charter Treaty,Electric power concession (nuclear),UTL,"?_15m, plus interest (on approximately ?_100m)",20,yes,0,0,n.a.,n.a.,n.a.,n.a.
2010,UKR,2009,independent,independent,NA,NA,NA,state,0,0,,0,NA,,,ARB/09/11,"Global Trading Resource Corp. and Globex International, Inc. v. Ukraine",1,0,NA,NA,NA,USA,,0,n.a.,n.a.,n.a.,n.a.,ICSID,United States-Ukraine BIT,Agricultural enterprise (poultry),AGR,unknown,unknown,yes,0,0,no,n.a.,n.a.,n.a.
2006,YUG,2005,NA,NA,NA,NA,NA,state,0,0,,0,NA,,,IIC 345,Mytilineos Holdings SA v. Serbia & Montenegro and Serbia,1,-999,NA,NA,NA,GRC,,NA,n.a.,n.a.,n.a.,n.a.,PCA,Greece-Yugoslavia BIT,Mining,MIN,Approximately US$25m,25,yes,0,0,n.a.,n.a.,n.a.,n.a.
2008,ZAR,2005,independent,NA,NA,NA,NA,state,0,0,,0,NA,,,ARB/05/21,"African Holding Company of America, Inc. & Societe Africaine de Construction au Congo SARL v. Democratic Republic of the Congo",1,0,NA,NA,NA,USA,,0,n.a.,n.a.,n.a.,n.a.,ICSID,Congo (Democratic Republic of)-United States BIT,unknown,MFG,unknown,unknown,yes,0,0,no,n.a.,n.a.,n.a.
2000,ZAR,1998,AFDL,AFDL,NA,NA,NA,state,0,0,,0,NA,,coalition,ARB/98/7,"Banro American Resources, Inc. and Societe Aurif??re du Kivu et du Maniema S.A.R.L. v. Democratic Republic of the Congo",1,1,0,0,0,CAN,,0,n.a.,n.a.,n.a.,n.a.,ICSID,Congo (Democratic Republic of) Mining Law,Mining (gold),MIN,unknown,unknown,yes,0,0,no,n.a.,n.a.,n.a.
2015,BOL,2010,MAS,MAS,1.333,1,1,settlement (US$357m),1,1,,1,1.283,1.204,,ARB/10/8,Pan American Energy LLC v. Plurinational State of Bolivia,0,3,1,1,2,ARG,,0,n.a.,n.a.,n.a.,n.a.,ICSID,Bolivia-United States BIT,Oil and gas,OIL,US$1500m,1500,yes,settlement,settlement,n.a.,n.a.,n.a.,n.a.
2014,ALB,2013,PSS,PDS,4.04,0,1,settlement,1,1,,NA,2.439,,,n.a.,CEZ v. The Republic of Albania,NA,3,1,1,2,CZE,,0,n.a.,n.a.,n.a.,n.a.,UNCITRAL,Energy Charter Treaty,Electric power concession,UTL,?_200m,267,yes,settlement,settlement,n.a.,n.a.,n.a.,n.a.
1997,ALB,1995,PDS,PDS,4.04,0,0,settlement,1,1,,NA,4.04,,,ARB/95/1,Leaf Tobacco A. Michaelides SA and Greek-Albanian Leaf Tobacco & Co. SA v. Republic of Albania,NA,1,0,0,0,GRC,,0,n.a.,n.a.,n.a.,n.a.,ICSID,Albania-Greece BIT,"Manufacturing (cigarettes, tobacco)",MFG,unknown,unknown,yes,settlement,settlement,n.a.,n.a.,n.a.,n.a.
2009,AZE,2006,YAP,YAP,3.7,0,0,settlement,1,1,,0,3.616,3.63,,ARB/06/16,Barmek v. Azerbaijan,1,0,NA,NA,NA,TUR,,0,n.a.,n.a.,n.a.,n.a.,ICSID,"Turkey-Azerbaijan BIT, Contract",Electric power concession,UTL,unknown,unknown,yes,settlement,settlement,n.a.,n.a.,n.a.,n.a.
2009,AZE,2007,YAP,YAP,3.866,0,0,settlement,1,1,,0,3.616,3.63,,ARB/07/1,Fondel Metal v Azerbaijan,1,0,NA,NA,NA,NLD,,0,n.a.,n.a.,n.a.,n.a.,ICSID,Contract with host state,Aluminum (bauxite),MIN,Approximately US$390m,390,yes,settlement,settlement,n.a.,n.a.,n.a.,n.a.
2006,BOL,2002,MAS,ADN,3.667,0,1,settlement,1,1,3.667 (1997),NA,1.204,,,ARB/02/3,Aguas del Tunari SA v. Republic of Bolivia,NA,3,1,1,2,NLD,,0,n.a.,n.a.,n.a.,n.a.,ICSID,Bolivia-Netherlands BIT,Water and sewage concession,UTL,unknown,unknown,yes,settlement,settlement,n.a.,n.a.,n.a.,n.a.
1998,CAN,1997,LPC,LPC,3.333,0,1,settlement,1,1,,0,2.134,,2.134 (2005),n.a.,Ethyl Corp v. Canada,1,3,1,1,2,USA,,0,n.a.,n.a.,n.a.,n.a.,UNCITRAL,NAFTA,Manufacturing (MMT gasoline additive),MFG,"Not less than US$251m, plus interest",251,yes,settlement,settlement,n.a.,n.a.,n.a.,n.a.
2011,CAN,2009,CPC,CPC,4.667,0,0,settlement,1,1,,0,4.181,,,n.a.,Dow Agrosciences LLC v. Canada,1,1,0,0,0,USA,,0,n.a.,n.a.,n.a.,n.a.,UNCITRAL,NAFTA,Manufacturing (specialty chemical products),MFG,US$2m,2,yes,"No monetary award, but Canada/Quebec withdraw the regulation and allow chemical to be sold",settlement,n.a.,n.a.,n.a.,n.a.
2013,CAN,2011,CPC,CPC,4.667,0,0,settlement,1,1,,0,4.181,,,n.a.,St. Mary's VCNA LLC v. Canada,1,1,0,0,0,USA,,0,n.a.,n.a.,n.a.,n.a.,PCA,NAFTA,Mining (quarrying),MIN,US$275m,275,yes,settlement (no payment disclosed in Consent Award),settlement,n.a.,n.a.,n.a.,n.a.
2014,CAN,2014,CPC,CPC,4.667,0,0,settlement,1,1,,0,4.181,,,n.a.,J.M. Longyear LLC v. Canada,1,1,0,0,0,USA,,0,n.a.,n.a.,n.a.,n.a.,UNCITRAL,NAFTA,Lumber,AGR,CAD12m,10.9,no,n.a.,n.a.,n.a.,n.a.,n.a.,n.a.
2010,CAN,2010,CPC,CPC,4.667,0,0,settlement,1,1,,NA,4.181,,,n.a.,AbitibiBowater Canadian Entities,NA,1,0,0,0,USA,,0,n.a.,n.a.,n.a.,n.a.,UNCITRAL,NAFTA,Pulp and paper manufacturer (also owned and operated hydroelectric generation faciliites),MFG,CAD500m,467.5,yes,settlement for CAD130m,n.a.,n.a.,n.a.,n.a.,n.a.
2000,CIV,1997,independent,PDCI,4.6,0,NA,settlement,1,1,,NA,NA,,,ARB/97/8,Compagnie Fran??aise pour le Developpement des Fibres Textiles v. Cote d'Ivoire,NA,0,NA,NA,NA,FRA,,0,n.a.,n.a.,n.a.,n.a.,ICSID,Contract with host state,Textile enterprise,MFG,unknown,unknown,yes,settlement,settlement,n.a.,n.a.,n.a.,n.a.
2011,DEU,2009,CDU,CDU,4,0,0,settlement,1,1,,0,3.637,,,ARB/09/6,"Vattenfall AB, Vattenfall Europe AG, Vattenfall Europe Generation AG v. Federal Republic of Germany",1,1,0,0,0,SWE,,0,n.a.,n.a.,n.a.,n.a.,ICSID,Energy Charter Treaty,Electricity concession (coal power plant),UTL,?_1.4b,1800,yes,settlement,settlement,n.a.,n.a.,n.a.,n.a.
2009,DOM,2007,PLD,PLD,4.042,0,0,settlement,1,1,,0,3.864,3.887,,n.a.,TCW v Dominican Republic,1,2,1,NA,1,USA,,0,n.a.,n.a.,n.a.,n.a.,UNCITRAL,CAFTA-DR,Electric power concession,UTL,US$500m,500,yes,settlement,settlement,n.a.,n.a.,n.a.,n.a.
2004,ECU,2002,PSP,DP,3.5,0,1,settlement,1,1,,NA,2.553,,,ARB/02/10,IBM World Trade Corp. v. Republic of Ecuador,NA,0,NA,NA,NA,USA,,0,n.a.,n.a.,n.a.,n.a.,ICSID,Ecuador-United States BIT,Software,SER,unknown,unknown,yes,settlement,settlement,n.a.,n.a.,n.a.,n.a.
2007,EST,2006,SDE,ERL,3.6,0,1,settlement,1,1,ERa,NA,2.002,,,ARB/06/6,"Rail World LLC, et al v. Republic of Estonia",NA,0,NA,NA,NA,NLD,,0,USA,n.a.,n.a.,n.a.,ICSID,"Estonia-Netherlands BIT, Estonia-United States BIT",Transportation (rail),UTL,unknown,unknown,yes,settlement,settlement,n.a.,n.a.,n.a.,n.a.
2012,GEO,2008,UNM,UNM,4.571,0,0,settlement,1,1,,1,3.876,,,n.a.,iZEE v Georgia,0,0,NA,NA,NA,USA,,0,n.a.,n.a.,n.a.,n.a.,UNCITRAL,Georgia-United States BIT,unknown,unknown,unknown,unknown,yes,settlement,settlement,n.a.,n.a.,n.a.,n.a.
2010,GEO,2008,UNM,UNM,4.571,0,0,settlement,1,1,,NA,4.155,,,ARB/08/7,Itera International Energy LLC & Itera Group NV v. Georgia,NA,0,NA,NA,NA,USA,,0,NLD,n.a.,n.a.,n.a.,ICSID,"Georgia-United States BIT, Georgia-Netherlands BIT",Oil and gas (distribution),OIL,unknown,unknown,yes,settlement,settlement,n.a.,n.a.,n.a.,n.a.
2010,GEO,2009,UNM,UNM,4.678,0,0,settlement,1,1,4.571 (2008),NA,4.155,,,ARB/09/22,Itera International Energy LLC and Itera Group NV v. Georgia,NA,0,NA,NA,NA,USA,,0,NLD,n.a.,n.a.,n.a.,ICSID,"United States-Georgia BIT, Netherlands-Georgia BIT",Oil and gas (distribution),OIL,unknown,unknown,yes,settlement,settlement,n.a.,n.a.,n.a.,n.a.
2005,GHA,2003,NPP,NPP,3.781,0,0,settlement,1,1,3.75 (2004),NA,3.675,,,(PCA Case No. 2003-03),Telekom Malaysia v. Ghana,NA,1,0,0,0,MYS,,0,n.a.,n.a.,n.a.,n.a.,UNCITRAL,Ghana-Malaysia BIT,Telecommunications,TEL,unknown,unknown,yes,settlement,settlement,n.a.,n.a.,n.a.,n.a.
2002,HUN,2001,FiDeSz,FiDeSz,3.286,0,0,settlement,1,1,,NA,3.549,,,ARB/01/4,AES Summit Generation Ltd. v. Hungary,NA,3,1,1,2,GBR,,0,n.a.,n.a.,n.a.,n.a.,ICSID,"Hungary-United Kingdom BIT, Energy Charter Treaty",Electric power concession,UTL,unknown,unknown,yes,settlement,settlement,n.a.,n.a.,n.a.,n.a.
2014,LVA,2013,Unity,Unity,4,0,0,settlement,1,1,V,NA,4.121,,,n.a., Bryn Services Ltd v. Latvia,NA,0,NA,NA,NA,CHE,,0,n.a.,n.a.,n.a.,n.a.,ICC,Switzerland-Latvia BIT,Banking,FIN,unknown,unknown,yes,settlement,settlement,n.a.,n.a.,n.a.,n.a.
2007,NIC,2006,FSLN,PLC,5,0,1,settlement,1,1,,0,2.282,,2.193 (2006),ARB/06/14,Shell Brands International AG & Shell Nicaragua SA v. Republic of Nicaragua,1,3,1,1,2,NLD,,0,n.a.,n.a.,n.a.,n.a.,ICSID,Netherlands-Nicaragua BIT,Oil and gas,OIL,unknown,unknown,yes,settlement,settlement,n.a.,n.a.,n.a.,n.a.
2001,PER,1998,Change 90,Change 90,4.416,0,0,settlement,1,1,,NA,4.254,,,ARB/98/6,Compagnie Mini??re Internationale Or S.A. v. Republic of Peru,NA,1,0,0,0,FRA,,0,n.a.,n.a.,n.a.,n.a.,ICSID,France-Peru BIT,Mining (gold),MIN,unknown,unknown,yes,settlement,settlement,n.a.,n.a.,n.a.,n.a.
2008,PHL,2002,Lakas-CMD,Lakas-CMD,4.5,0,0,settlement,1,1,,0,4.381,,,ARB/02/6,SGS Societe Generale de Surveillance SA v. Republic of the Philippines,1,2,1,NA,1,CHE,,0,n.a.,n.a.,n.a.,n.a.,ICSID,Philippines-Switzerland BIT,Consulting services (testing and verification),SER,"Approximately US$140m, plus interest",140,yes,settlement,settlement,n.a.,n.a.,n.a.,n.a.
2011,POL,2006,PO,PiS,3.428,0,0,settlement,1,1,,0,3.451,,,n.a.,Vivendi v. Poland,1,2,1,NA,1,FRA,,0,n.a.,n.a.,n.a.,n.a.,UNCITRAL,France-Poland BIT,Telecommunications (mobile),TEL,unknown,unknown,yes,settlement,settlement,n.a.,n.a.,n.a.,n.a.
2014,PRY,2007,Colorado,Colorado,4.5,0,0,settlement,1,1,,0,4.385,,,ARB/07/9,"Bureau Veritas, Inspection, Valuation, Assestment and Control, BIVAC BV v. Republic of Paraguay",1,1,0,0,0,NLD,,0,n.a.,n.a.,n.a.,n.a.,ICSID,Netherlands-Paraguay BIT,Consulting services,SER,unknown,unknown,yes,settlement,settlement,n.a.,n.a.,n.a.,n.a.
2012,SEN,2008,PDS,PDS,4.333,0,0,settlement,1,1,,1,4.249,,,ARB/08/20,"Millicom International Operations BV, et al v. Senegal",0,1,0,0,0,NLD,,0,n.a.,n.a.,n.a.,n.a.,ICSID,"Netherlands-Senegal BIT, Contract",Telecommunications,TEL,unknown,unknown,yes,settlement,settlement,n.a.,n.a.,n.a.,n.a.
2013,SVK,2012,Smer-SD,SDKU,4.2,0,1,settlement,1,1,,0,1.884,,,ARB/12/7,"Slovak Gas Holding BV, GDF International SAS and E.ON Ruhrgas International GmbH v. Slovak Republic",1,3,1,1,2,DEU,,0,NLD,n.a.,n.a.,n.a.,ICSID,Energy Charter Treaty,Oil and gas,OIL,unknown,unknown,yes,settlement,settlement,n.a.,n.a.,n.a.,n.a.
2005,TUR,2004,AKP,AKP,3.88,0,0,settlement,1,1,,1,3.933,,4.041 (2007),ARB/04/21,Motorola Credit Corporation Inc. v. Republic of Turkey,0,0,NA,NA,NA,USA,,0,n.a.,n.a.,n.a.,n.a.,ICSID,Turkey-United States BIT,Telecommunications (mobile),TEL,unknown,unknown,yes,settlement,settlement,n.a.,n.a.,n.a.,n.a.
2015,TUR,2015,AKP,AKP,4.8,0,0,settlement,1,1,,NA,4.853,,,ARB/15/26,Nabucco Gas Pipeline International GmbH in Liqu. v. Republic of Turkey,NA,0,NA,NA,NA,AUT,,0,n.a.,n.a.,n.a.,n.a.,ICSID,Austria-Turkey BIT,Oil and gas (pipeline),OIL,unknown,unknown,yes,settlement,settlement,n.a.,n.a.,n.a.,n.a.
2000,UKR,1998,MBR,MBR,3.143,0,0,settlement,1,1,NDP; 3.143 (1998),NA,3.208,,3.208 (1998); NDPU,ARB(AF)/98/1,Joseph Charles Lemire v. Ukraine,NA,2,1,NA,1,USA,,0,n.a.,n.a.,n.a.,n.a.,ICSID AF,Ukraine-United States BIT,Broadcasting enterprise (radio),TEL,unknown,unknown,yes,settlement,settlement,n.a.,n.a.,n.a.,n.a.
2007,USA,2002,Republicans,Republicans,5,0,0,settlement,1,1,,0,4.654,,,n.a.,Kenex Ltd. v. United States of America,1,1,0,0,0,CAN,,0,n.a.,n.a.,n.a.,n.a.,UNCITRAL,NAFTA,Agricultural enterprise (hemp),AGR,Not less than US$20m,20,yes,settlement,settlement,n.a.,n.a.,n.a.,n.a.
2007,VNM,2005,CPV,CPV,3.3,0,0,settlement,1,1,,1,3.939,,VFF,n.a.,Trinh Vinh Binh & Binh Chau Joint Stock Company v. Socialist Republic of Viet Nam,0,3,1,1,2,NLD,,1,n.a.,n.a.,n.a.,n.a.,UNCITRAL,Netherlands-Vietnam BIT,Manufacturing (frozen food),MFG,unknown,unknown,yes,settlement,settlement,n.a.,n.a.,n.a.,n.a.
2010,YEM,2009,GPC,GPC,3.429,0,1,settlement,1,1,,NA,2.955,,2.955 (2003),ARB/09/7,MTN (Dubai) Limited and MTN Yemen for Mobile Telephones v. Republic of Yemen,NA,0,NA,NA,NA,ARE,,1,n.a.,n.a.,n.a.,n.a.,ICSID,"Yemen-UAE BIT, Yemen Investment Law (2002)",Telecommunications (mobile),TEL,unknown,unknown,yes,settlement,settlement,n.a.,n.a.,n.a.,n.a.
2014,ARG,2012,FPV,FPV,1.727,1,1,settlement,1,1,,1,1.5605,,,ARB/12/38,"Repsol, S.A. and Repsol Butano, S.A. v. Argentine Republic",0,3,1,1,2,ESP,,0,n.a.,n.a.,n.a.,n.a.,ICSID,Argentina-Spain BIT,Oil and gas,OIL,US$10bn,10000,yes,settlement,settlement,n.a.,n.a.,n.a.,n.a.
2012,ARG,2008,FPV,FPV,1.727,1,1,settlement,1,1,,NA,1.555,,,ARB/08/14,Impregilo SpA v. Argentine Republic,NA,3,1,1,2,ITA,,0,n.a.,n.a.,n.a.,n.a.,ICSID,Argentina-Italy BIT,Highway construction project,UTL,unknown,unknown,yes,settlement,settlement,n.a.,n.a.,n.a.,n.a.
2007,ARG,2003,FPV,PJ,2.545,1,1,settlement,1,1,,0,1.554,,,ARB/03/7,Camuzzi International S.A. v. Argentine Republic,1,3,1,1,2,BELLUX,,0,n.a.,n.a.,n.a.,n.a.,ICSID,"Belgium & Luxembourg-Argentina BIT, US-Argentina BIT",Electric power concession,UTL,US$245m,245,yes,settlement,settlement,n.a.,n.a.,n.a.,n.a.
2008,ARG,2003,FPV,PJ,2.545,1,1,settlement,1,1,,0,1.557,,,ARB/03/10,Gas Natural SDG SA v. Argentine Republic,1,3,1,1,2,ESP,,0,USA,n.a.,n.a.,n.a.,ICSID,"Argentina-Spain BIT, Argentina-US BIT",Oil and gas,OIL,unknown,unknown,yes,settlement,settlement,n.a.,n.a.,n.a.,n.a.
2008,ARG,2003,FPV,PJ,2.545,1,1,settlement,1,1,,0,1.557,,,ARB/03/13 consolidated with ARB/04/8,Pan American Energy LLC & BP Argentina Exploration Company v. Argentine Republic,1,3,1,1,2,USA,,0,n.a.,n.a.,n.a.,n.a.,ICSID,Argentina-United States BIT,Electric power and hydrocarbon concessions,OIL,US$1.321b,1321,yes,settlement,settlement,n.a.,n.a.,n.a.,n.a.
2009,ARG,2003,FPV,PJ,2.545,1,1,settlement,1,1,,0,1.56,,,ARB/03/20,Telefonica SA v. Argentine Republic,1,3,1,1,2,ESP,,0,n.a.,n.a.,n.a.,n.a.,ICSID,Argentina-Spain BIT,Telecommunications,TEL,unknown,unknown,yes,settlement,settlement,n.a.,n.a.,n.a.,n.a.
2009,ARG,2005,FPV,PJ,2.545,1,1,settlement,1,1,,0,1.56,,,ARB/05/2,Compania General de Electricidad SA & CGE Argentina SA v. Argentine Republic,1,3,1,1,2,CHL,,0,n.a.,n.a.,n.a.,n.a.,ICSID,Argentina-Chile BIT,Electric power concession,UTL,US$125m,125,yes,settlement,settlement,n.a.,n.a.,n.a.,n.a.
2005,ARG,2003,PJ,PJ,2.545,1,1,settlement,1,1,,0,2.582,,,ARB/03/12,"Pioneer Natural Resources Company, Pioneer Natural Resources (Argentina) SA & Pioneer Natural Resources (Tierra del Fuego) SA v. Argentine Republic",1,3,1,1,2,USA,,1,n.a.,n.a.,n.a.,n.a.,ICSID,Argentina-United States BIT,Electric power concession,UTL,unknown,unknown,yes,settlement,settlement,n.a.,n.a.,n.a.,n.a.
2011,ARG,2005,FPV,PJ,2.545,1,1,settlement,1,1,,NA,1.546,,,n.a.,Bank of Nova Scotia (or Scotiabank BNS) v. Argentine Republic,NA,3,1,1,2,CAN,,0,n.a.,n.a.,n.a.,n.a.,UNCITRAL,Argentina-Canada BIT,Banking,FIN,Approximately US$600m,600,yes,settlement,settlement,n.a.,n.a.,n.a.,n.a.
2007,ARG,2003,FPV,PJ,2.545,1,1,settlement,1,1,,NA,1.554,,,ARB/03/18,"Aguas Cordobesas SA, Suez, and Sociedad General de Aguas de Barcelona SA v. Argentine Republic",NA,3,1,1,2,FRA,,0,ESP,n.a.,n.a.,n.a.,ICSID,"Argentina-Spain BIT, Argentina-France BIT",Water services concession,UTL,unknown,unknown,yes,settlement,settlement,n.a.,n.a.,n.a.,n.a.
2008,ARG,2004,FPV,PJ,2.545,1,1,settlement,1,1,,NA,1.557,,,ARB/04/8 consolidated with ARB/03/13,"BP America Production Company, Pan American Sur SRL, Pan American Fueguina, SRL and Pan American Continental SRLothers v. Argentine Republic",NA,3,1,1,2,USA,,0,n.a.,n.a.,n.a.,n.a.,ICSID,Argentina-France BIT,Electric power and hydrocarbon concessions,OIL,US$1.321b,1321,yes,settlement,settlement,n.a.,n.a.,n.a.,n.a.
2009,ARG,2004,FPV,PJ,2.545,1,1,settlement,1,1,,NA,1.56,,,ARB/04/9,CIT Group Inc. v. Argentine Republic,NA,3,1,1,2,USA,,0,n.a.,n.a.,n.a.,n.a.,ICSID,Argentina-United States BIT,Leasing enterprise,RE,US$120m,120,yes,settlement,settlement,n.a.,n.a.,n.a.,n.a.
2006,ARG,2004,FPV,PJ,2.545,1,1,settlement,1,1,,NA,1.603,,,ARB/04/18,France Telecom SA v. Argentina Republic,NA,3,1,1,2,FRA,,0,n.a.,n.a.,n.a.,n.a.,ICSID,Argentina-France BIT,Telecommunications,TEL,US$300m,300,yes,settlement,settlement,n.a.,n.a.,n.a.,n.a.
2006,ARG,2004,FPV,PJ,2.545,1,1,settlement,1,1,,NA,1.603,,,ARB/04/20,RGA Reinsurance Company v. Argentine Republic,NA,3,1,1,2,USA,,0,n.a.,n.a.,n.a.,n.a.,ICSID,United States-Argentina BIT,Finance (reinsurance),FIN,unknown,unknown,yes,settlement,settlement,n.a.,n.a.,n.a.,n.a.
1998,BDI,1995,independent,Frodebu,2,1,NA,settlement,1,1,2 (1993),0,NA,,,ARB/95/3,Antoine Goetz et al v. Burundi,1,0,NA,NA,NA,BELLUX,,0,n.a.,n.a.,n.a.,n.a.,ICSID,Belgium & Luxembourg-Burundi BIT,Mining,MIN,Approximately US$175m,175,yes,settlement,settlement,n.a.,n.a.,n.a.,n.a.
2008,BOL,2008,MAS,MAS,1.333,1,1,settlement,1,1,,1,1.204,,,68/2008,AEI Luxembourg Holdings v. Bolivia,0,3,1,1,2,BELLUX,,0,n.a.,n.a.,n.a.,n.a.,SCC,Belgium & Luxembourg-Bolivia BIT,Oil and gas (gas pipeline),OIL,US$120m,120,yes,settlement,settlement,n.a.,n.a.,n.a.,n.a.
2008,BOL,2008,MAS,MAS,1.333,1,1,settlement,1,1,,NA,1.204,,,n.a.,Gastrans Boliviano v. Bolivia,NA,3,1,1,2,GBR,,0,NLD,BRA,n.a.,n.a.,UNCITRAL,Bolivia-United Kingdom BIT,Oil and gas,OIL,GTB agreed to withraw claim in 2011 in exchange for US$39.3m,39.3,yes,settlement,settlement,n.a.,n.a.,n.a.,n.a.
2010,BOL,2007,MAS,MAS,1.333,1,1,settlement,1,1,,NA,1.204,,,ARB/07/28,ETI Euro Telecom International NV v. Plurinational State of Bolivia,NA,3,1,1,2,NLD,,0,n.a.,n.a.,n.a.,n.a.,ICSID,Bolivia-Netherlands BIT,Telecommunications,TEL,unknown,unknown,yes,settlement,settlement,n.a.,n.a.,n.a.,n.a.
2011,BOL,2010,MAS,MAS,1.333,1,1,settlement,1,1,,NA,1.204,,,n.a.,Oiltanking GmbH and the Grana y Montero Group v. Bolivia,NA,3,1,1,2,DEU,,0,PER,n.a.,n.a.,n.a.,PCA,"Bolivia-Germany BIT, Bolivia-Peru BIT",Oil and gas,OIL,US$30m,30,yes,settlement,settlement,n.a.,n.a.,n.a.,n.a.
2015,BOL,2015,MAS,MAS,1.4,1,1,settlement,1,1,,NA,1.283,1.204,,n.a.,Paz Holdings Ltd. v. Plurinational State of Bolivia,NA,3,1,1,2,GBR,,0,n.a.,n.a.,n.a.,n.a.,UNCITRAL,Plurinational state of Bolivia v. United Kingdom,Electric power concession,UTL,unknown,unknown,yes,settlement-US$19.51m,settlement-19.51,n.a.,n.a.,n.a.,n.a.
2013,CHN,2011,CCP,CCP,2.96,1,1,settlement,1,1,,NA,2.629,,,ARB/11/15,Ekran Berhad v. People's Republic of China,NA,3,1,1,2,MYS,,0,ISR,n.a.,n.a.,n.a.,ICSID,"China-Malaysia BIT, China-Israel BIT",Tourism (arts and culture facilities),SER,unknown,unknown,yes,settlement,settlement,n.a.,n.a.,n.a.,n.a.
1997,COG,1997,UPADS,UPADS,1,1,1,settlement,1,1,,0,1.386,,1.386 (1993),ARB/97/2,Societe Kufpec (Congo) Limited v. Republic of Congo,1,3,1,1,2,GBR,,0,KWT,n.a.,n.a.,n.a.,ICSID,other (as coded by ICSID),Oil and gas,OIL,unknown,unknown,yes,settlement,settlement,n.a.,n.a.,n.a.,n.a.
2008,COG,2006,PCT,PCT,1,1,1,settlement,1,1,,NA,1.356,,,ARB/06/12,Scancem International ANS v. Republic of Congo,NA,3,1,1,2,NOR,,0,n.a.,n.a.,n.a.,n.a.,ICSID,Contract with host state,Manufacturing (cement),MFG,unknown,unknown,yes,settlement,settlement,n.a.,n.a.,n.a.,n.a.
2009,CZE,2005,ODS,CSSD,1.571,1,0,settlement,1,1,,0,4.263,4.229,,n.a.,Mittal Steel Company NV (Dutch company) v Czech Republic,1,0,NA,NA,NA,NLD,,0,n.a.,n.a.,n.a.,n.a.,UNCITRAL,Czech Republic-Netherlands BIT,Steel production,MFG,unknown,unknown,yes,settlement,settlement,n.a.,n.a.,n.a.,n.a.
2009,CZE,2005,ODS,CSSD,1.571,1,0,settlement,1,1,,NA,4.263,4.229,,n.a.,K+Venture Partners v. Czech Republic,NA,0,NA,NA,NA,NLD,,0,n.a.,n.a.,n.a.,n.a.,UNCITRAL,Czech Republic-Netherlands BIT,Finance (venture capital),FIN,?_4.7m,5.1,yes,settlement,settlement,n.a.,n.a.,n.a.,n.a.
2008,DEU,2000,CDU,SPD,2.75,1,0,settlement,1,1,,NA,3.696,3.637,,n.a.,Ashok Sancheti v. Germany,NA,1,0,0,0,IND,,0,n.a.,n.a.,n.a.,n.a.,UNCITRAL,Germany-India BIT,Real estate,RE,"Not less than US$36m, plus costs",36,yes,settlement,settlement,n.a.,n.a.,n.a.,n.a.
2013,DZA,2009,FLN,FLN,1.5,1,1,settlement,1,1,,NA,1.674,,,ARB/09/14,"Maersk Olie, Algeriet A/S v. People's Democratic Republic of Algeria",NA,3,1,1,2,DNK,,1,n.a.,n.a.,n.a.,n.a.,ICSID,Denmark-Algeria BIT,Oil and gas,OIL,Over US$11b,11000,yes,settlement,settlement,n.a.,n.a.,n.a.,n.a.
2009,ECU,2005,PAIS,PSP,2.833,1,1,settlement,1,1,,0,2.937,,,ARB/05/12,Noble Energy Inc. & Machala Power Cia. Ltd. v. Republic of Ecuador & Consejo Nacional de Electricidad,1,3,1,1,2,USA,,0,n.a.,n.a.,n.a.,n.a.,ICSID,"Ecuador-United States BIT, Contract",Electric power concession,UTL,unknown,unknown,yes,settlement,settlement,n.a.,n.a.,n.a.,n.a.
2003,GUY,2001,PPP,PPP,2.5,1,1,settlement,1,1,,NA,2.674,,,ARB/01/9,Booker PLC v. Guyana,NA,3,1,1,2,GBR,,0,n.a.,n.a.,n.a.,n.a.,ICSID,Guyana-United Kingdom BIT,Agricultural enterprise (sugar),AGR,"Approximately US$10m in damages, plus US$8m in interest and costs",10,yes,settlement,settlement,n.a.,n.a.,n.a.,n.a.
2004,IDN,2004,PDI-P,PDI-P,2,1,1,settlement,1,1,,0,2.111,,,ARB/04/3,Cemex Asia Holdings Ltd v. Indonesia [Brought by Singaporean subsidiary of Cemex SA de CV (Mexico)],1,0,NA,NA,NA,SGP,,0,n.a.,n.a.,n.a.,n.a.,ICSID,"Contract, ASEAN Agreement for the Promotion and Protection of Investments (1987)",Manufacturing (cement),MFG,Approximately US$400m,400,yes,settlement,settlement,n.a.,n.a.,n.a.,n.a.
2005,IND,2004,INC,PDI-P,2,1,1,settlement,1,1,,NA,2.394,,2.349 (2004),n.a.,Erste Bank Der Oesterreichischen Sparkassen AG v. India,NA,3,1,1,2,AUT,,0,n.a.,n.a.,n.a.,n.a.,UNCITRAL,Austria-India BIT,Electric power concession,UTL,unknown,unknown,yes,settlement,settlement,n.a.,n.a.,n.a.,n.a.
2005,IND,2004,INC,PDI-P,2,1,1,settlement,1,1,,NA,2.394,,2.349 (2004),n.a.,BNP Paribas v. India,NA,3,1,1,2,FRA,,0,n.a.,n.a.,n.a.,n.a.,UNCITRAL,France-India BIT,Electric power concession,UTL,unknown,unknown,yes,settlement,settlement,n.a.,n.a.,n.a.,n.a.
2005,IND,2004,INC,PDI-P,2,1,1,settlement,1,1,,NA,2.394,,2.349 (2004),n.a.,Credit Lyonnais SA (now Calyon SA) v. India,NA,3,1,1,2,FRA,,0,n.a.,n.a.,n.a.,n.a.,UNCITRAL,France-India BIT,Electric power concession,UTL,unknown,unknown,yes,settlement,settlement,n.a.,n.a.,n.a.,n.a.
2005,IND,2004,INC,PDI-P,2,1,1,settlement,1,1,,NA,2.394,,2.349 (2004),n.a.,"Offshore Power Production CV, Travamark Two BV, EFS India-Energy BV, Enron BV, & Indian Power Investments BV (Netherlands) v. India",NA,3,1,1,2,NLD,,0,n.a.,n.a.,n.a.,n.a.,UNCITRAL,India-Netherlands BIT,Electric power concession,UTL,Over US$4b,4000,yes,settlement,settlement,n.a.,n.a.,n.a.,n.a.
2005,IND,2004,INC,PDI-P,2,1,1,settlement,1,1,,NA,2.394,,2.349 (2004),n.a.,Credit Suisse First Boston v. India,NA,3,1,1,2,CHE,,0,n.a.,n.a.,n.a.,n.a.,UNCITRAL,India-Switzerland BIT,Electric power concession,UTL,unknown,unknown,yes,settlement,settlement,n.a.,n.a.,n.a.,n.a.
